id,field_id,titel_autor,rasignatur,volltext,unique_key,file,field
20169,1950.0,SUGAYA (CH/IA),88448,88448 Sugaya Chia Böhm Rolf Fuchs Emmerich Fächer Gerhard Systementwicklung in der Wirtschaftsinformatik 4 Überarbeitete und erweiterte Auflage Wirtschaftsinformatik Zürich vdf Hochschulverlag AG an,88448SUGAYA (CH/IA)lag AG an ,chunk_8,
20170,1951.0,CATELLANI (CH/STIZ),87405,874 05 PottiSCHTIZ Martin James Das Cyberunternehmen total digital vernetzt Aus dem Amerikanischen von Isabella Kowatsch Wien Wirtschaftsverlag Carl Ueberreuter 1997 22 cm 395 S,87405CATELLANI (CH/STIZ)cm.395 S. ,chunk_1,
20171,1952.0,CATELLANI (CH/STIZ),87418,37418 Catellani CHISTIZ Nonaka Ikujiro Takeuchi Hirotaka Die Organisation des Wissens Wie japanische Unternehmen eine brachliegende Ressource nutzbar machen Aus dem Englischen von Friedrich Mader Frankfurt/Main Campus Verlag GmbH 1997,"87418CATELLANI (CH/STIZ)H, 1997 ) ",chunk_1,
20172,1953.0,CATELLANI (CH/STIZ),87467,87467 Catellani Chistiz Jugendliche Trendsetter oder Ausgeschlossene Ein statistisches Porträt der Jugend Beiträge zur Sozialberichterstattung für die Schweiz Les jeunes donnent-ils le ton oder sind-ils die Exklusen Ein portrait statistisches de,87467CATELLANI (CH/STIZ)ti- que de,chunk_1,
20173,1954.0,CATELLANI (CH/STIZ),87504,87504 Catellani Chastiz Rosenthal David Projekt Internet Was Unternehmen über Internet und Recht wissen müssen Mitarbeit Felix H Thomann und Rolf Auf der Maur Zürich Verlag Finanz und Wirtschaft AG 1997 24 cm XXI 401 S,"87504CATELLANI (CH/STIZ)XXI,401 S ",chunk_1,
20174,1955.0,CATELLANI (CH/STIZ),87505,875.5 Catellani CHISTIZ Gummesson Evert Relationship Marketing Von 4P zu 30R Wie Sie von den 4 Marketingprinzipien zu den 30 Erfolgbeziehungen kommen Aus dem Englischen übertragen von Barbara Foramitti Landsberg Lech Verlag moderne Indu,87505CATELLANI (CH/STIZ)derne Indu,chunk_1,
20175,1956.0,CATELLANI (CH/STIZ),87527,87527 Catellani CHSTIZ Meyer Thomas Rust Hanspeter Wieviele Studierende an den schweizerischen Hochschulen Prognosen 1997–2004 Statistik der Schweiz 15 Bildung und Wissenschaft Bern Bundesamt für Statistik 1997 30 cm 44 S,"87527CATELLANI (CH/STIZ)30cm,44 S ",chunk_1,
20176,1957.0,CATELLANI (CH/STIZ),87535,87535 Catellani Chistiz Lutz Christian Leben und Arbeiten in der Zukunft 2. Auflage München Wirtschaftsverlag Langen Müller-Herbig 1997 24 cm 335 S,87535CATELLANI (CH/STIZ)cm.335 S. ,chunk_1,
20177,1958.0,CATELLANI (CH/STIZ),87539,87539 Catellani Chistiz Lammoth Friedhelm Handshake Marketing und Customer Value Die neuen Aktiva des Wandels Ettlingen IM Marketing Forum 1997 30cm 50 S,"87539CATELLANI (CH/STIZ)0cm.50 S, ",chunk_1,
20178,1959.0,CATELLANI (CH/STIZ),87667,87667 Catellani Christiz Kinder Zeit und Geld Eine Analyse der durch Kinder bewirkten finanziellen und zeitlichen Belastungen von Familien und der staatlichen Unterstützungsleistungen in der Schweiz Mitte der Neunziger Jahre Autor Tobias Bauer,87667CATELLANI (CH/STIZ)bias Bauer,chunk_1,
20179,1960.0,CATELLANI (CH/STIZ),84999,84999 Catellani XHSTIZ Zucker Betty Mittendrin und voll daneben Manager in turbulenten Zeiten Mit Illustrationen von Nico 2. Auflage Zürich Werd Verlag 1999 24cm 95 S,84999CATELLANI (CH/STIZ)24cm.95 S ,chunk_1,
20180,2011.0,LIAUDET (KI 526),82773,82775 Llaudet Kl 526 Langenecheidt LB Handwörterbuch Französisch Berlin 1981,82773LIAUDET (KI 526)n (1981). ,chunk_5,
20181,2012.0,LIBEREK,94265,Liberek Stanislas 94265 t Liberek Stanislas Pestalozzi und Kœciuzekko Studie v StL Aus dem Französischen übersetzt von Adèle Tatarinoff Eggensohwiler Solothurn Gäbsmann 1946 31 S K 419 Dr,94265STANISLAVLIBEREK419	<Dr-> ,chunk_5,
20182,2013.0,LIBERTÉ,,Liberté Liberté la du citoyen en Recht suisse s Freiheit die des Bürgere ira schweizerischen Recht 1948,"LIBERTÉt, (1948) ",chunk_5,
20183,2014.0,LIBERTÉS,,Libertés Libertés noé Bréviaire du citoyen Publié par la Section Armée et Foyer de lAdjudance générale de lArmée Premier au sixième mille Lausanne : FRouge l94l 63 S 1943 4192 J,LIBERTÉS      /(J ,chunk_5,
20184,2015.0,LIBRARIUM,,Librarium Librarium Zeitschrift der Schweizerischen Bibliophilen Gesellschaft Revue de la Société suisse des bibliophiles 1976 I Hoft I u Thalwil Dr Albert Bettex Sonnenbergstr. 47 1976 24 cm Faks Portr. Taf. u,LIBRARIUMrtr.Taf u ,chunk_5,
20185,2016.0,LIBRO,,"Brück, E. Brück, E. Reichsgesetz über den Versicherungsvertrag nebst dem zugehörigen Einführungsgesetz Vom 30. Mai 1908 7. Auflage Guttentagsche Sammlung Deutscher Reichsgesetze Nr. 83 Berlin: W. de Gruyter & Co. 1932 (VIII, 563, 56 S.)",LIBROines   .. ,chunk_5,
20186,2017.0,LICHTENFELS,,"Lichtenfels Wolfgang von Lichtenfels Wolfgang von Über einige Fragen des Binnenversicherungsgesetzes mit besonderer Rücksicht auf Österreich. Wien, Manz 1870. 68 S. (kf M ¡f 58 B)",WOLFGANG VONLICHTENFELS          ,chunk_5,
20187,2018.0,LICHTENSTERN,,Lichtenstern Tho. s. Duden Wörterbuch medizinischer Fachausdrücke,THEOLICHTENSTERNausdrucke ,chunk_5,
20188,2019.0,LICHTGESTALTUNG,86796,Lichtgestaltung in Lichtgestaltung für repräsentative Räume Informationen zur Lichtanwendung Heft 9 Frankfurt/Main Fördergemeinschaft Gutes Licht 1988 A 30/35 34426,86796LICHTGESTALTUNG.35 34426 ,chunk_5,
20189,2020.0,LICHTSTEINER,,Lichtsteiner René und Huber Bruno Die Genossenschaft Vortrag von BH1 von RL1 Überarbeitet und erweitert,"RENÉLICHTSTEINERweitert), ",chunk_5,
20190,2071.0,BELLOM,,Bellom Maurice. Bellom Maurice. Les questions ouvrières et la science actuarielle. Paris: H. Dunod E. Pinat 1909. 101 S,MAURICEBELLOM  (101 S.),chunk_0,
20191,2072.0,BELLOVIN,,"Bellovin, Steven M. Cheswick, William R. Firewalls and Internet Security: Replacing the Wily Hacker",STEVEN M.BELLOVINcker   ..*,chunk_0,
20192,2073.0,BELMONT,10209,Bezont Werner 4 ° Belmont Werner Rechtliche Natur und Bedeutung der Police Diss Tniv Basel Maschinenschrift Basel 1940 VI 107 S,"10209WERNERBELMONTVI,107 S.)",chunk_0,
20193,2074.0,BELOW,,Below Fritzs Weg der ins Alter,"FRITZBELOWins Alter,",chunk_0,
20194,2075.0,BELSER,,Baiser Katharinas Darf auch eine Frau sein Eine Untersuchung zur geschlechtsspezifischen Ausschreibung von Stelleninseraten Redaktion KB,KATHARINABELSER: K'B' ...,chunk_0,
20195,2076.0,BELSER,12200,Baiser Peter Michael f Ober3erf Peter Michael Versicherungsgenossenschaften Eine Studie ihrer rechtlichen Besonderheiten Das Univ Zürich Zürich Juris Druck ft Verlag 1975 2 cm XIV 173 S,"12200PETER MICHAELBELSERXIV,173 S.",chunk_0,
20196,2077.0,BELSER,5103/45,eiser Versicherungsrecht Überarbeitete Fassung eines am 24. Oktober 1957 vor dem Zürcherischen Juristenverein gehaltenen Vertrages SA a Energie aus dem Atom 2195800 1958b,5103/45W.BELSER.0. 1958.b,chunk_0,
20197,2078.0,BELZ,87266,Beiz Christian Beiz Christian Strategisches Direct Marketing Vom sporadischen Direct Mail zum professionellen Database Management mit Fail Studien Mitautoren HP Künzler H Hädrich ua Forschungsinstitut für Absatz und Handel Universität St Gallen,87266CHRISTIANBELZität St.Ga,chunk_0,
20198,2079.0,BELZ,86481,Beiz Christian Belz Christian Suchfelder ira Marketing Schrift zum 50jährigen Jubiläum der GfM Schweizerischen Gesellschaft für Marketing GfM Dok No 151 Zürich St. Gallen GfM Schweizerische Gesellschaft für Marketing Hochschule St. Gallen 1991,"86481CHRISTIANBELZlen, 1991.",chunk_0,
20199,2080.0,BELZ,84766,Beiz Christian Beiz Christian Förderung des Lerntransfers in der überbetrieblichen Weiterbildung von Marketing Führungskräften Dias St Gallen FAH Schriftenreihe Marketing und Management Band 2 Uttvil Verlag Auditorium AG 1981,84766CHRISTIANBELZ).        ,chunk_0,
20200,2041.0,JAHRBUCH,71010,Jahrbuch 71 010 Jahrbuch für das Versicherungswesen im Deutschen Reiche Lebens Renten Unfall und Haftpflichtversicherung Von Cari Heumann 1913–1920 Portos Jahrbuch der Lebens Renten und Volkversicherungen i,71010JAHRBUCHicherune i,chunk_4,
20201,2042.0,JAHRBUCH,9144,Jahrbuch für die deutschen Versicherungsangestellten Jg. 1927 Herausgegeben von Allgemeinen Verband der Versicherungsangestellten e.V. Berlin. Berlin Verlag der Herausgeber 1926,9144JAHRBUCHg.[l926]. ,chunk_4,
20202,2043.0,JAHRBUCH,70508,Jahrbuch G v P Jahrbuch gewerbliches Annuaire suisse des arts et métiers Herausgegeben Schweizerischen Gewerbeverband Ausgabe 1943 1946 Bern: Büchler Dr 1944 ff V 243 S t 1944 5122,"70508JAHRBUCH44, 5122. ",chunk_4,
20203,2044.0,JAHRBUCH,7508,Jahrbuch Jahrbuch gothaische für Diplomatie Verwaltung und Wirtschaft Jg 163 1926 Gotha Justus Perthes 1926 52934 S 1317,7508JAHRBUCH S.) 1317 ,chunk_4,
20204,2045.0,JAHRBUCH,87932,Jahrbuch Marketing Kommunikation JL 994—5 Auflage des Herausgebers Roland Köhler Redaktion Uli Rubner St. Gallen Künzler Bächiann AG für 994 30 cm 32487,87932JAHRBUCH0cm 32487 ,chunk_4,
20205,2046.0,JAHRBUCH,420,Jahrbuch 420 Jahrbuch Neumanns der privaten und öffentlichrechtlichen Versicherung im Deutschen Reich vereinigt mit Wallmanns Deutscher Versicherungs-Kalender 1936 Fortsetzung. Neumanns Jahrbuch der Privatversicherung im Deutschen Reich fortgesetzt.,420JAHRBUCH[Forts.s.:,chunk_4,
20206,2047.0,JAHRBUCH,5068,Jahrbuch Jahrbuch schweizerisches für Hausbesitzer 1926 Zürich Füssli 1926 175 S,5068JAHRBUCH	(175 S.) ,chunk_4,
20207,2048.0,JAHRBUCH,93476,Jahrbuch Jahrbuch statistisches des Fürstentums Liechtenstein 1997 21. Ausgabe Vaduz Amt für Volkswirtschaft des Fürstentums Liechtenstein 1997 24 cm XIII 376 S G Hrsger,93476JAHRBUCHHrsger	^^ ,chunk_4,
20208,2049.0,JAHRBUCH,98506,Jahrbuch Jahrliches statistisches des Kantons Zürich 1990 1— Aue — 1990 Hrsg. vom Statistischen Amt des Kantons Zürich Forts v Handbuch statistisches des Kantons Zürich Zürich 1990 31. Okt. 94  S 28 476,98506JAHRBUCH S 28 476 ,chunk_4,
20209,2050.0,JAHRBUCH,7401,Jahrbuch 7401 Jahrbuch statistisches für das Deutsche Reich Herausg. Statistischen Reichsamt Jg. 1888 241903 261905 351912 451926 und 46192 Fortschrittliches Statistisches Jahrbuch für die Bundesrepublik Deutschland Berlin 1888 1927,7401JAHRBUCH.	( \( -' ,chunk_4,
20210,2031.0,ETUDES,3691,Etudes 3 Etudes de philosophie des sciences En hommage à Ferdinand Gonseth à l'occasion de son soixantième anniversaire Bibliothèque scientifique Série dialectica Vol. 20 Neuchâtel Editions du Griffon 1950 23 cm 176 p 1 portr G,3691ETUDES1 portr G ,chunk_2,
20211,2032.0,ETUDES,7873/A,Etudes Etudes économiques et sociales publiées à l'occasion du XXVe anniversaire de la fondation de la Faculté des Sciences économiques et sociales de l'Université de Genève Publications de la Faculté des Sciences économiques et sociales de l'Université,7873/AETUDES l'Univers,chunk_2,
20212,2033.0,ETUDES,7437,Etudes et Recherches Publiques 1 J. Association internationale de Sécurité Sociale AISS Nol Forts v Revue internationale d actuarial et statistique de la sécurité sociale de Genève 1970,7437ETUDES 1970   - ,chunk_2,
20213,2034.0,ETUDES,8427/1-4,Etudes Etudes françaises Cours de base deuxième degré Hrsg. von Rita Erdle Hähner unter Mitwirkung von Günter Freitag u. a. 4 Teilbände Grundwerk Vocabulaire contextuel Grammatikisches Beiheft Cahier der Übungen Zug Verlag Klett Balmer 1,"8427/1-4ETUDESalmer,   1",chunk_2,
20214,2035.0,ETUDIANTS,,Studentinnen Studierenden die an den schweizerischen Hochschulen,"ETUDIANTShschulen, ",chunk_2,
20215,2036.0,ETZENBACH,,Etzbach Ernsts Rechtshandbuch Vermögen und Investitionen in der ehemaligen DDR Hrsg. von Hermann Clemm EE,ERNSTETZENBACHE'E' . .. ,chunk_2,
20216,2037.0,EU-/EG-VERTRAG,83963,EUEG Vertrag EUSG Vertrag Vertrag über die Europäische Union Vertrag zur Gründung der Europäischen Gemeinschaft und ergänzende Rechtsvorschriften Teilausgabe zusammenge stellt und mit einer Einführung von Werner Kaufmann Bühler 2 erweitert,83963EU-/EG-VERTRAG erweitert,chunk_2,
20217,2038.0,EUGSTER,,Eugster C. H. A. Höhn Walter Schweizerische und ausländische Naturwissenschaftler im Bild,C. H.EUGSTER im Bild. ,chunk_2,
20218,2039.0,EUGSTER,94268/5,"Eugster, Conrad Hans. Conrad Hans. Über den Fliegenpilz. Neujahrsblatt der Naturforschenden Gesellschaft in Zürich 169 Mit 1 Tafel Zürich Leemann 1967 39 S G 880",94268/5CONRAD HANSEUGSTERS.) G 880 ,chunk_2,
20219,2040.0,EULER,72013,Euler Leonhard Euler Leonhard Opera omnia Series I ff Übersicht über die bisher erschienenen Bände s grüne Karte J Leipzig: Teubner 1911,72013LEONHARDEULERner 1911- ,chunk_2,
20220,2031.0,WIRTSCHAFT,423,Wirtschaft 423 Wirtschaft und Recht der Versicherung Beiheft zur Zeitschrift Deutsche öffentlichrechtliche Versicherung Jg 192 ff 4 7 J lückenhaft Berlin Dahler & Co. 192 faj,423WIRTSCHAFT2&-   /faj,chunk_9,
20221,2032.0,WIRTSCHAFT,71769,Wirtschaft und Verwaltung Vierteljahrshefte herausgegeben vom Statistischen Amte des Kantone Basel-Stadt Jahrgang I 1942 ff 7 Jg. 1948 Basel: Schwabe 1942 1949,71769WIRTSCHAFT1942-1949.,chunk_9,
20222,2033.0,WIRTSCHAFT,,"12345. Brück, E. Brück, E. Reichsgesetz über den Versicherungsvertrag nebst dem zugehörigen Einführungsgesetz Vom 30. Mai 1908 7. Auflage Guttentagsche Sammlung Deutscher Reichsgesetze Nr 83 Berlin W de Gruyter & Co 1932 VIII 563 56 S",WIRTSCHAFTS ,chunk_9,
20223,2034.0,WIRTSCHAFTLICH,,Wirtschaftlich bauen Sonderheft 10s Kräntzer Karl Richard Grundrissbeispiele für Geschosswohnungen und Einfamilienhäuser,WIRTSCHAFTLICHhäuser ...,chunk_9,
20224,2035.0,WIRTSCHAFTS-,,Wirtschafts- und Finanzbulletin der Kantonalbank in Bern Hr 14a Dreier Hans Die Elektrizitätsversorgung im Übergang zur Atomenergie,WIRTSCHAFTS-omenergie.,chunk_9,
20225,2036.0,WIRTSCHAFTS-,BV 30,Wirtschafts Wirtshaftsausführer 24 Portraits aus Wirtschaft und Politik Text Redaktion Bilanz Thalwil Oesch Verlag 1979 29 cm 126 S Portr 18043,BV 30WIRTSCHAFTS-ortr.18043,chunk_9,
20226,2037.0,WIRTSCHAFTSBEZIEHUNGEN,268,Wirtschaftsbeziehungen 268 Wirtschaftsbeziehungen die Italienischschweizerischen Abhandlung der Bank für Anlagewerte 1947 Heft 2 Zürich 1947 46 S,268WIRTSCHAFTSBEZIEHUNGEN7.	(46 S.),chunk_9,
20227,2038.0,WIRTSCHAFTSBILDER,195,Wirtschaftsbilder 195 Wirtschaftsbilder Zürcher Beartiv Statistisches Bureau des Kantons Zürich Jg. I 1945 ff. Zürich 1945,195WIRTSCHAFTSBILDERrich 1945-,chunk_9,
20228,2039.0,WIRTSCHAFTSBULLETIN,,Wirtschaftsbulletin Wirtschaftsbulletin der Kantonalbank von Bern Nr. 17 s Berger Fritz Daa Wohnungswesen der Schweiz 1973,WIRTSCHAFTSBULLETINeiz. 1973.,chunk_9,
20229,2040.0,WIRTSCHAFTSDIENST,97263,Wirtschaftsdienst Z C 3 Wirtschaftsdienst 47 1967 Nr 7,"97263WIRTSCHAFTSDIENST7,   Nr.7.",chunk_9,
20230,2031.0,SCHAFFHAUSEN,1649/SH-1,Schaffhausen Schaffhausen Kanton Gesetz über die Einführung des Schweizerischen Zivilgesetzbuches vom 27. Juni 1911 Schaffhausen 1987 21cra 58 S,1649/SH-1SCHAFFHAUSENcra.58 S. ,chunk_7,
20231,2032.0,SCHAFFHAUSEN,1649,Schaffhausen Schaffhausen Kanton Bericht organiation des Kantons Schaffhausen Schaffhausen 1935 45 S K 4044,1649SCHAFFHAUSEN.) K 4044 ,chunk_7,
20232,2033.0,SCHAFFHAUSEN,1649/SH-3,Schaffhausen Schaffhausen Kanton S. trifftprozeas Ordnung für den Kanton Schaffhausen vom 3. März 1909 4. Mai 1964 Schaffhausen 1964 21 cm 69 S 1370517766,"1649/SH-3SCHAFFHAUSEN5/17766 , ",chunk_7,
20233,2034.0,SCHAFFHAUSEN,1649/SH-4,Schaffhausen Schaffhausen Kantont Gesetz über den Rechtsschutz in Verwaltungssachen Verwaltungsrechtspflege vom 20. September 1971 Schaffhausen VfJ 21 cm 15 3 • 17766,1649/SH-4SCHAFFHAUSEN3 • 17766 ,chunk_7,
20234,2035.0,SCHAFFHAUSEN,1649/SH-2,Schaffhausen Schaffhausen Kanton Zivilprozessordnung für den Kanton Schaffhausen vom 3. September 1951 Anhang Konkordat über die Schiedsgerichtsbarkeit Stand Januar 1979 Mit Änderungen bis 7. September 1987 Schaffhausen,1649/SH-2SCHAFFHAUSENaffhausen ,chunk_7,
20235,2036.0,SCHAFFHAUSEN  1997/98,94667,Schaffhausen Schaffhausen Kanton Staatakalender Schaffhausen Staatskanzlei 1965 21 cm 87 70A,94667SCHAFFHAUSEN  1997/98m. 87 7oA ,chunk_7,
20236,2037.0,SCHAFFHAUSEN / STADT,,Schaffhausen Stadtplan und Führer von Schaffhausen und Kempten aPlan 0,"SCHAFFHAUSEN / STADTPlan,.. 0 ",chunk_7,
20237,2038.0,SCHAFFHAUSER,12658,Schaffhauser René Schaffhauser René Schlaurì Franz Hrsger Verfahrensfragen in der Sozialversicherung Referate der Tagung des Schweizerischen Instituts für Verwaltungs Kurse vom 24. Oktober 1995 in Luzern Veröffentlichungen des Schweiz,12658RENÉSCHAFFHAUSERes Schweiz,chunk_7,
20238,2039.0,SCHAFFHAUSER,12415,Schaffhauser René Schaffhauser René Zellweger Jakob Grundriß des schweizerischen Strassenverkehrsrechts 2 Bände Bd I Verkehrszulassung und Verkehrsregeln von RS1 336 S 1984 Bd II Haftpflicht und Versicherung von RS und JZ 418 S,"12415RENÉSCHAFFHAUSER'. 418 S.,",chunk_7,
20239,2040.0,SCHÄFFLER (FI/AS),87670,"87670 Schaffier FIAS Microsoft Access 97 Developer's Handbook by Timothy M. O'Brien, Steven J. Pogge, Geoffrey E. White Solution Developer Series Redmond WA Microsoft Press 1997 24 cm XXII 596 p. 1 CD-ROM",87670SCHÄFFLER (FI/AS)1 CD-ROM. ,chunk_7,
20240,1931.0,GESETZESSAMMLUNG,,Gesetzessammlung Gesetzessammlung für den Kanton St. Gallen Bd. IV. Hauptabteilung. Über das Personen- und Familienrecht Das Sachenrecht Das Vertragsrecht Über die Gericht Organisation und das Verfahren bei Rechtstreitigkeiten. St. Gallen: Zollikofer,GESETZESSAMMLUNGen:Zolliko,chunk_3,
20241,1932.0,GESETZESSAMMLUNG,118/A,Gesetzessammlung Gesetzessammlung Zürcher Zürcher Loseblattsammlung Systematische Sammlung in 10 Banden Stand 1. Januar 1993 ff Zürich Staatskanzlei des Kantons Zürich 1993 • 23cralO Bände Loseblattslg 31332,118/AGESETZESSAMMLUNGlg. 31332 ,chunk_3,
20242,1933.0,GESETZESSAMMLUNG,118,Gesetzessammlung « Gesetzessammlung Zürcher Am 1. Januar 1981 in Kraft stehende Erlasse des Kantons Zürich 7 Bände Zürich Staatskanzlei des Kantons Zürich 1981 22 cm A 7 Bde 19657 Kein SWK,118GESETZESSAMMLUNG	Kein SWK ,chunk_3,
20243,1934.0,GESETZESSAMMLUNG,117,Gesetzessammlung 7• Gesetzessammlung Zürcher Am Januar 1961 in Kraft stehende Erlasse des Kantons Zürich Bände Zurich Staatskanzlei des Kantons Zürich 1961—1962 6225,117GESETZESSAMMLUNG962. 6225 ,chunk_3,
20244,1935.0,GESETZESTEXTE,,Gesetzestexte Gesetzestexte des Versicherungsrechts Heft 1 S Versicherungvertragsrecht 1948,GESETZESTEXTEit	(1948) ,chunk_3,
20245,1936.0,GESETZESTEXTE,91107/1,Gesetzestexte Gesetzestexte des Versicherungsrechts Heft 1 911 07 1 7 tf f y Hamburg Rechte und Staatswiesenschaft Verlag 1948,91107/1GESETZESTEXTElag 1948- ,chunk_3,
20246,1937.0,GESETZGEBUNG,7524/1.2,Gesetzgebung V Jt Z Gesetzgebung Bürgerliche für den Kanton Aargau 2 Bde Bd I Allgemeines bürgerliches Gesetzbuch Bd II Prozesse und Vollstreckung Gesetze Aarau 1858 558,7524/1.2GESETZGEBUNG1858. 558 ,chunk_3,
20247,1938.0,GESETZGEBUNG,71034,Getzgebung und Getzgebung im Bereich der landwirtschaftlichen Deutschen Bundes. Herausgegeben vom Schweizerischen Landwirtschaftsdepartement Zürich. Orell Füssli 1894 C. 168 S. XI 29,71034GESETZGEBUNG) •	XI 29 ,chunk_3,
20248,1939.0,GESETZGEBUNG,2959 D,Gesetzgebung vom 7. Juli Gesetzgebung schweizerisches über das private Versicherungswesen Bereinigt auf 1. Juli 1948 Herausgegeben von der Bundeskanzlei Fortsetzung des Versicherungswesens privates Bern 1948 72 S. K. 1312,2959 DGESETZGEBUNG.) K 1312 ,chunk_3,
20249,1940.0,GESETZGEBUNG,2959 C,Gesetzgebung Gesetzgebung schweizerische über das private Versicherungswesen Législation suisse en matière d’assurances privées Bern Wyes 1944 8282 S 1945 5373,"2959 CGESETZGEBUNG945,5373- ",chunk_3,
20250,2011.0,P (CHARDONNENS),84105,84105 P. Chardonnens Larousse nouveau petit 1973,84105P (CHARDONNENS)it. 1973. ,chunk_6,
20251,2012.0,P (EGLIN),82340,82340 P. Eglin ZIP Code Directory,82340P (EGLIN)ctory ... ,chunk_6,
20252,2013.0,P (EGLIN),84288,84288 PEGlin Zürich und Umgebung Straβenverzeichnis von 15 Städten und 83 Gemeinden,84288P (EGLIN)emeinden. ,chunk_6,
20253,2014.0,P (LANDOLT),81958 + 81959,81958 P Landolt 81959 Vornamen in der Schweiz,81958 + 81959P (LANDOLT)r Schweiz ,chunk_6,
20254,2015.0,P (LANDOLT),82263 + 82264,82263 82264 P. Landolt Jacot Arthur Schweizerisches Ort Lexikon,82263 + 82264P (LANDOLT)xikon ... ,chunk_6,
20255,2016.0,P 310,"84314/1,2",6431412 P 310 Vornamen in der Schweiz Prenoms en Sulsse I noml in Svizzera « Prenoms in Svizra 12 Auflage,"84314/1,2P 310Aufläge). ",chunk_6,
20256,2017.0,P 319,82050,82050 P 319 Kroes HWJ Duits Handwörterbuch Teil II,82050P 319el In.II. ,chunk_6,
20257,2018.0,P 330,82343,82343 33 o Duden Stilwörterbuch der deutschen Sprache,82343P 330 Sprache. ,chunk_6,
20258,2019.0,P 330,82354/1.2,8235412 P 330 Melzi il novissimo,82354/1.2P 330ovissimo. ,chunk_6,
20259,2020.0,P 330,82577,82577 P 330 Larousse illustrierter Petit Dictionnaire encyclopédique pour tous Edition 1980,"82577P 330on] 1980, ",chunk_6,
20260,2021.0,LIDSTONE,,Lidstone G. T. Lidstone G. J. Accuracy of arithmetical approximation Edinburgh: Faculty of Actuaries in Scotland 1938. 12 S.,G.J.LIDSTONE  (12 S.) ,chunk_5,
20261,2022.0,LIEBE,6308,Liebe Liebe Versicherung Humor und unfreiwillige Komik in Zuschriften von Versicherten Freiburg Schweiz Kanisius Verlag 1988 17 cm 47 S,6308LIEBE17cm 47 S ,chunk_5,
20262,2023.0,LIEBELT,85988,Liedet Wolfgang Liebelt Wolfgang Sulzberger Markus Grundlagen der Ablauforganisation Schriftenreihe Der Organisator Band 9 Gießen Verlag Dr. Götz Schmidt 1989 24 cm 270 S 27247 W,85988WOLFGANGLIEBELT7247	W ^o ,chunk_5,
20263,2024.0,LIEBERMEISTER,,Liebermeister G. Liebermeister G. Tuberkulose Ihre verschiedenen Erscheinungsformen und Stadien sowie ihre Bekämpfung Mit 16 zum Teil farbige Textabb. Berl. Springer 1921 VI 456 S. Von Frl. Dr. med. Müller,"G.LIEBERMEISTERd, Müller ",chunk_5,
20264,2025.0,LIEBETANZ,,Lietetanz t Paul liebtanz Paul Die Anwerbekosten in der Lebensversicherung und ihre Deckung Lübeck r Selbstverlag Verfassers 1953 S • ÇK j vJ T Dr. Mathematiker,PAULLIEBETANZematiker) ,chunk_5,
20265,2026.0,LIEBETANZ,,Liebetanz P. Liebetanz P. Der umgearbeitete Gesetzentwurf über den Versicherungsvertrag vom Standpunkt der Versicherungsmathematik Veröffentlicht Deutsch Verf Ver Wissenschaft Heft 4 Berlin 1905 S 184 186 W Dr. phil. s,P.LIEBETANZr.phil)	s ,chunk_5,
20266,2027.0,LIEBETRAU,,Georg S. Becker Mario Hatoerfellner Reinhard LG EDV W Isaen für Anwender,GEORGLIEBETRAUder   ... ,chunk_5,
20267,2028.0,LIEBL,,Liebl Karl Hans s BetriebrsSpionage Begehungsformen Schutzmassnahmen Rechtsfragen Hrsg KHL,KARL HANSLIEBL  K'H'L'. ,chunk_5,
20268,2029.0,LIEBL,,Liebl Karlhans s Zimmerli Erwin LK computermissstrauchcomputersicherheit,KARLHANSLIEBLeit   ... ,chunk_5,
20269,2030.0,LIEBMANN,,Liebmann Franz G. S. Wolff Karl. Heina Demographische und medizinische Untersuchungen in Österreich Projektleiter Karl-Heinz Wolff Mitarbeiter Josef Juch FGL,FRANZ G.LIEBMANN'G.L* ... ,chunk_5,
20270,2081.0,BEMERKUNGEN,,Bemerkungen Bemerkungen zu einigen zur Kranken und Unfallversicherung mit besonderer Berücksichtigung der Landwirtschaft 00 190 32 S 58 B,BEMERKUNGEN(32 S.)58B,chunk_0,
20271,2082.0,BEMESSUNG,2606,Bemessung der dauernden Erwerbsunfähigkeit in der Sozialversicherung Studien und Berichte des Internationalen Arbeitsamtes Reihe M Sozialversicherung Hr. 14 Genf Buchdrucker 1938 XV 392 S. 2468,2606BEMESSUNG92 S.)2468,chunk_0,
20272,2083.0,BÉNAC,82218,Bénac Henri Bénac Henri Dictionnaire des synonymes conforme au Dictionnaire de lAcadémie française Réimpression de lédition 1956 Paris Librairie Hachette 1979 21 cm 1026 p 18879,82218HENRIBÉNAC026 p18879,chunk_0,
20273,2084.0,BÉNAC,42,Bénac Henri Bénac Henri Dictionnaire des synonymes conforme au Dictionnaire de l'Académie Française Paris Hachette 1956 1026 p,42HENRIBÉNAC(1026  p.),chunk_0,
20274,2085.0,BENATALLAH,,Benatallah Boualetns Bouguettaya Athman BB Elmagarmid Ahmed Interconnecting heterogeneous information systems,BOUALEMBENATALLAHystems ...,chunk_0,
20275,2086.0,BENCHMARKING-,ORD.262,Benchmarking Benchmarking Umfrage Schweiz 1994 Executive Summary Studie der STG Coopers Lybrand Consulting AG zusammen mit der Handelszeitung Zürich 1994 50 cm 21 T 313256 o,ORD.262BENCHMARKING- T31-3256o,chunk_0,
20276,2087.0,BENDEL,1682,"Bendel Felix. Bendel Felix. Die strafrechtliche Verantwortlichkeit beider Verletzungen der Regeln der Baukunde Art. 229 StGB. Mit einem Vorwort von Prof. Dr. Jean Graven. Winterthur: P. G. Keller 1960. XXIX, 158 S. 58/85",1682FELIXBENDEL58 S.)5885,chunk_0,
20277,2088.0,BENDEL,,Bendel H. Hochmals zur Einführung allgemeiner Handwerkerschulen Beilagôheft zur Schweizerischen Zeitschrift für Gemeinnützigkeit Zürich E. Leemann 1895 28 S. 58 B. Schaffhausen v,H.BENDEL        'v,chunk_0,
20278,2089.0,BENDER,418/1,Bender H P F Bender H P. Meldung Rücktritt Stellung Schriftenreihe Angewandte Versicherungsmathematik 11 Heft 1 Karlruhe Verlag Versicherungswirtschaft 1975 J 21 cm 57 S 14648,418/1H.P.BENDER57 S.14648,chunk_0,
20279,2090.0,BENDER,91403/12,Bender James PBender James F Hohe Schule der Verkaufena Die Macht der Überzeugung SKV Taschenbuch Nr 12 Zürich Verlag SKV 1971 8° 128 S,"91403/12JAMES F.BENDER8°,^128 S.",chunk_0,
20280,1951.0,SUGAYA (CH/ITSE),87347,87347 Yfeoingart CHUNS Vermeulen Robert Upgrading relational databases with objects Managing object technology series 8 New York SIGS Books Multimedia 1996 24 cm XIX 212 p,"87347SUGAYA (CH/ITSE)XIX,212 p ",chunk_8,
20281,1952.0,SUGAYA (CH/ITSE),87370,87370 Sugaya CHITSE Grochow Jerrold M Information overload Creating value with the new information systems technology Yourdon Press computing series Upper Saddle River NJ Yourdon Press 1997 25cm XX281 p,"87370SUGAYA (CH/ITSE)XX,281 p. ",chunk_8,
20282,1953.0,SUGAYA (CH/ITSE),87371,87371 Sugaya CHITSE Cattali RGG Barry Douglas K ed The Object Database Standard ODMG 2.0 Ed by RGGC DKB Contributors Dirk Bartels Mark Berlerao The Morgan Kaufmann series in data management systems CA Morgan Kaufmann,87371SUGAYA (CH/ITSE)gan Kaufma,chunk_8,
