id,field_id,titel_autor,rasignatur,volltext,unique_key,file,field
23824,2409.0,FINANZ-JAHRBUCH,,Finanz-Jahrbuch Finanz-Jahrbuch schweizerisches Annuaire financier suisse 1899 ff S t Bern: Zimmermann 1899 1955 Zürich: Verlag Kompass Schweiz AC I960,FINANZ-JAHRBUCHA.C. I960 ,chunk_2,
23825,2410.0,FINANZ-KONGLOMERATE,,"Brück, E. Brück, E. Reichsgesetz über den Versicherungsvertrag nebst dem zugehörigen Einführungsgesetz vom 30. Mai 1906 5. Auflage von E. Brück Guttentagsche Sammlung Deutscher Reichsgesetze Nr. 83 Berlin W. de Gruyter & Co 1926 (Z 5)",FINANZ-KONGLOMERATEers   ... ,chunk_2,
23826,2371.0,PESTALOZZI,,Pestalozzi Johann Heinrich Pestalozzi Johannes Heinrich Sämtliche Werke Kritische Ausgabe Begründet von Artur Buchenau Eduard Spranger Hans Stettbacher Übersichtlich Über die erschienenen Bände Zürich Orell Füssli 1927 1971,JOHANN HEINRICHPESTALOZZI927-1971. ,chunk_6,
23827,2372.0,PESTALOZZI HENGGELER,93011,Pestalozzi Henggeler Anton 95011 Pestalozzi Henggeler Anton Die verdeckte Gewinnausschüttung im Steuerrecht Steuer und Wirtschaft Band 4 Basel Verlag für Recht und Gesellschaft 1947 XII 92 3 K 823 M Dr,93011ANTONPESTALOZZI HENGGELER  M	(Dr.) ,chunk_6,
23828,2373.0,PESTALOZZI SCHAEFER,,ïestalozzi Schäfer Pestalozzi Schäfer Martin s Festschrift Walter Schaufelberger 60 Jahre,MARTINPESTALOZZI SCHAEFER60 Jahre] ,chunk_6,
23829,2374.0,PESTALOZZIGESELLSCHAFT,,Pestalozzigesellschaft in Zürich Verein für Volksbildung und Volkswohlfahrt Jahresbericht 1940/41 Zürich Aachmann Scheller Dr. 1941,PESTALOZZIGESELLSCHAFTDr. 1941- ,chunk_6,
23830,2375.0,PESTAUTON,31165,Petauton Pierre Petauton Pierre. Theorie et pratique de l'assurance vie. Paris: Dunod Bordas 1991. 26 cm XVI 199 p. 29447.,31165PIERREPESTAUTON9 p 29447 ,chunk_6,
23831,2376.0,PESTMAN,2810,Pestman P Peatman P D De be s ohe ria ing van den liypotheek houder tegen beschadiging van den verbonden opstal durch middel van verzekering Amsterdam ECS Schrik 1934 XVIII 256 p,"2810P.D.PESTMANI,256 p.) ",chunk_6,
23832,2377.0,PÉTAIN,94225,Pétain SF 94 225 Pétain Reportage über den Prozess gegen Warschau Pétain Berühmte Prozesse Band I Zürich: Juris Verlag 1946 115 S K 116,94225PÉTAINS.) K 116 ,chunk_6,
23833,2378.0,PETER,94471/6,Peter Charlotte Peter Charlotte Hans Caspar Escher 1775 1859 Illustr Schweizer Pioniere der Wirtschaft und Technik Bd 6 Zurich Verein für wirtschaftshistorische Studien 1956 22 S K 4126,94471/6CHARLOTTEPETER.) K 4126 ,chunk_6,
23834,2379.0,PETER,,Peter Daniel s Schweizer Pioniere der Wirtschaft und Technik Bd7,DANIELPETERik. Bd.7) ,chunk_6,
23835,2380.0,PETER,5121/50,Peter Ernat Peter Ernst Die Lebensversicherungsgesellschaften als Kreditgeber aus der Schweizerischen Handelswissenschaftlichen Zeitschrift Mitteilungen aus dem Handelswissenschaftlichen Seminar der Universität Zürich Heft 40 Zürich Schult,5121/50ERNSTPETERch: Schult,chunk_6,
23836,2401.0,WYSS (BUCHHALTUNG),84083,84085 Wys Buchhaltung Uller Bachofner Max Rechnen an der kaufmännischen Lehrabschlussprüfung Schlossseel zur 2. Auflage,84083WYSS (BUCHHALTUNG).Auflage. ,chunk_9,
23837,2402.0,WYSS (BUCHHALTUNG),84084,84084 Wyaa Buchhaltung Ulller Weil U Walther H Buchhaltungsaufgaben aus den kaufmännischen Lehrabschlussprüfungen,"84084WYSS (BUCHHALTUNG)rüfungen, ",chunk_9,
23838,2403.0,WYSS (CH/IX),88105,88105 Ahdreaès CHIX Swan Tom Die Delphi 4 Bibel Übersetzung aus dem Amerikanischen von GU Technische Dokumentation GmbH Bonn MITP Verlag GmbH 1998 25 cm 1103 S. CD-ROM,88105ANDREASWYSS (CH/IX)l CD-ROM. ,chunk_9,
23839,2404.0,WYSSEN,,Wyssen Rudolf es Kummer Walter A. Spuhler Roland W. WR1 Projekt Management,RUDOLFWYSSENment   ...,chunk_9,
23840,2405.0,WYSSLING,,Wyssling Walters Schweizer Pioniere der Wirtschaft und Technik Bd. 8,WALTERWYSSLINGik.  Bd.8),chunk_9,
23841,2406.0,X OPEN,87820,X Open X Open CAE Spezifikation Generic Security Service API GSSAPI Basis X Open Dokument Nr C441 Reading UK X Open Company Limited 1995 27 cm XIV 114 p 37582,87820X OPEN14 p.37582,chunk_9,
23842,2407.0,X OPEN,86046,X 0 p e u X Open Portability Guide 7 Englewood Cliffs NJ Prentice Hall Inc 1988 1989 27498 W,86046X OPEN89)27498	W,chunk_9,
23843,2408.0,X OPEN UEBERSICHT,86046,0 P E N S Übersicht XSI com in an da and utilities 1988 XSI System interface and headers 1989 ZSI supplementary def initions 1989 Programming languages 1988 Data management 1988 Window management 1988 Networking Services 1988,86046X OPEN UEBERSICHTces. 1988.,chunk_9,
23844,2409.0,X TOOLKIT,86377,X toolkit X toolkit intrinsics reference manual 2nd edition for X11 Release 4 The X Window System series Vol 5 Sewastopol CA O'Reilly Associates Inc 1990 25 cm XII 764 p,"86377X TOOLKIT764 p.-,._",chunk_9,
23845,2410.0,X. 400,83687,400 X 400 elektronische Post und Datenkommunikation Die Normen und ihre Anwendung Autoren Bernhard Plattner G Lanz ua 3 überarbeitete und erweiterte Auflage Bonn Addison Wesley Deutschland GmH 1993,83687X. 4001993).    ,chunk_9,
23846,2301.0,TESTAS,,Testas Jean a Dictionnaire moderne français espagnol espagnol français par Ramón García Pelayo y Gross et JT1,JEANTESTASt J'T1... ,chunk_8,
23847,2302.0,TESTO,,Testo Unico delle Leggi sull'esercizio delle Assicurazioni Private Ministero dell'Industria e del Commercio Ispettorato delle Assicurazioni Private Roma Istituto Poligrafico dello Stato 1959 6 p 5231,TESTO p.) 5231 ,chunk_8,
23848,2303.0,TESTS,,Tests Tests komplexer Anwendungssysteme Schriftenreihe Betriebstechnische Prägen der Lebensversicherung 92 Folge Bonn Verband der Lebensversicherungsunternehmen e. V. Ausschuss für Betriebstechnik 1994 30 cm 40 S G Hrsger,2069/92TESTS G Hrsger ,chunk_8,
23849,2304.0,TESTUZ,1935,Testuz Hugues Testuz Hugues die machtstellungen des vertreters der versicherung im schweizerischen recht Lausanne Neue Bibliothek des Rechts und der Rechtsprechung 1959 102 S. 6208 Dr.,1935HUGUESTESTUZ208	(Dr.) ,chunk_8,
23850,2305.0,TETENS,,"Tetens, Joh. Nicol. Einleitung zur Berechnung der Leibrenten und Anwartschaften, die vom Leben und Tode einer oder mehrerer Personen abhängen. 2 Teile in 1 Band. Mit Tab.. Leipzig: Weidmann, 1785. (44, 604 IV, 302 S., 194)",JOH.NICOL.TETENS          ,chunk_8,
23851,2306.0,TETIGISTI,4131,Tetigisti Acu Tetigisti Acu Einigkeit der Völker durch vollkommene Wirtschaftsbefreiung BIG Die goldbasierte Universalwährung IBand Zürich WBraunSpyri 3tr2 1967 21 cm 285 S,4131ACUTETIGISTIm. 285 S. ,chunk_8,
23852,2307.0,TETZNER,,Tetzner F Tetzner F Wörterbuch sinnverwandter Ausdrücke Leipzig Ph Reclam 1895 472 S W Dr,FTETZNER) W	(Dr.) ,chunk_8,
23853,2308.0,TEUBNER,,Tevibner B s Sammlung BGTa von Lehrbüchern,"BTEUBNERrbüchern, ",chunk_8,
23854,2309.0,TEUBNER TASCHENBUCH,,Teubner Taschenbuch » Teubner Taschenbuch der Mathematik Begründet von IN Bronstein und KASemandjajew Weitergeführt von G Grosche V Ziegler D Ziegler Hrsg. von E Zeidler 2 Teile Teil I XXV 1298 S 1996 Teil II XVI 830 S 1995 Stuttgart,TEUBNER TASCHENBUCH995). Stut,chunk_8,
23855,2310.0,TEUCHER,5493,Teuber Eugen Teuber Eugen Unsere Bundesräte seit 1848 in Bild und Wort Eine Sammlung biographischer Essays über die 62 Bundesräte mit einleitendem Überblick über die schweizerische Geschichte seit 1848 Mit einem Geleitwort von Bundesrat Dr.,5493EUGENTEUCHERdesrat Dr.,chunk_8,
23856,2421.0,JOSUTTIE,,Josuttis Nicola s Programmieren mit OSF Motif Autoren Hans Joachim Brede NJ1,NICOLAIJOSUTTIE'J1   ... ,chunk_4,
23857,2422.0,JOURDAN,72189,"Jourdan, Paul. Notes de critique verbale sur Scribonius Largua. Thèse Univ. Heuchâtel, Paris: Klincksieck 1919. 104 S.",72189PAULJOURDAN.	(104S.) ,chunk_4,
23858,2423.0,JOURNAL,94488,Journal Czechoslovak Mathematical Vol. 1954 Nr. 1 and 2 Prague 1954,94488JOURNALgue 1954- ,chunk_4,
23859,2424.0,JOURNAL,7048,Journal Journal des Assurances Tome 251874 ff T Avec répertoire 1873 1883 1883 1899 1900 1911 1912 1921 Paris 1874 11,7048JOURNAL1874 - 11 ,chunk_4,
23860,2425.0,JOURNAL,650,Journal Journal «North American Actuarial Publi by the Society of Actuaries Vol. 1 No. 1 ff. Forts. Transactions of the Society of Actuaries Schaumburg IL Society of Actuaries 1997 28 cm 36169,650JOURNAL      •	- ,chunk_4,
23861,2426.0,JOURNAL,98015,Journal of Calendar Reform Vol. 1931 XXV 1955 published by the World Calendar Association New York 1931 1955 von Prof. Marchand,98015JOURNAL.Marchand ,chunk_4,
23862,2427.0,JOURNAL,640,Journal • 640 Journal of the Institute of Actuaries Vol 28 1890 67 1936 — 121 1994 u 1601 939 T With index to volumes 21 to 30 i to 40 With indices to volumes 66121 Forts s British actuarial journal 1995 ff L,640JOURNAL5   ff.) L,chunk_4,
23863,2428.0,JOURNAL,94806,Journal of Insurance Published by the American Risk and Insurance Association Vol. XXIX 1962 No. 3 Einzelnummer Bloomington Illinois 1962,"94806JOURNALis, 1962. ",chunk_4,
23864,2429.0,JOURNAL,723,Journal of Risk and Insurance Vol. XL 1973 Lept J. R. Bloomington Ill. American Risk and Insurance Association 1973,"723JOURNALn, 1973 - ",chunk_4,
23865,2430.0,JOURNAL,,"Brück, E. Brück, E. Reichsgesetz über den Versicherungsvertrag nebst dem zugehörigen Einführungsgesetz Vom 30. Mai 1908 7. Auflage Guttentagsche Sammlung Deutscher Reichsgesetze Nr 83 Berlin W de Gruyter & Co 1932 (VIII 563 56 S)","JOURNALs, VoU?4, ",chunk_4,
23866,2301.0,GÖTZ,1009,Götz Ernst Götz Ernst Die Eheschliessung Artikel 90136 ZGB 3 völlig neu gearbeitete Auflage des von Max Gmür begründeten Kommentars zum Eherecht Berner Kommentar Band II IAbt 1 Tlfcd lHalfte Bern Verlag Stam,1009ERNSTGÖTZerlag Stam,chunk_3,
23867,2302.0,GOUDSE,5131/16,Goudse Verzekeringsmaatschappij N V 1924 1964 Illustr Gouda 1964 8 S,5131/16GOUDSE4.	(8 S.) ,chunk_3,
23868,2303.0,GOUILLART,86829,Gouillart Francis J. Gouillart Francis J. Betelly James U. Business Transformation. Übersetzt aus dem Englischen. Transformation of the Organization. Manager Magazin Edition. Wirtschaftsverlag Carl Ueberreuter 1995. J. A. 21 cm. 446,86829FRANCIS J.GOUILLART-21cm.446 ,chunk_3,
23869,2304.0,GOULD,98079,Gould I H Gould I E IFIP Saehwörterbuch der Datenverarbeitung Erste deutschsprachige Ausgabe mit äquivalenten englischen und russischen Begriffen Herausgegeben in Zusammenarbeit mit der International Federation for Information Processing Thun Frankfurt,"98079I.H.GOULDn,Frankfur",chunk_3,
23870,2305.0,GOUMOENS,,Goumoens Eduard von a Schweizer Pioniere der Wirtschaft und Technik Band 12,EDUARD VONGOUMOENS  Band 12 ,chunk_3,
23871,2306.0,GOURY,,Goury H. Goury H. Les sociétés étrangères d'assurances sur la vie Paris : Agent d'Assurances 1913 S,H.GOURY  (13 S.) ,chunk_3,
23872,2307.0,GOWERS,,1. Cowers Ernest S. Fowler. HW A Dictionary of Modern English Usage,"ERNESTGOWERSsh usage, ",chunk_3,
23873,2308.0,GR,81402,8l402 Gr Weise »Albrecht Randbuch der betrieblichen Altersfürsorge 1952,81402GRge (1952) ,chunk_3,
23874,2309.0,GR (BOSSHARD),82262,82262 Gr BoBshard Helbling Carl Personalfürsorge,82262GR (BOSSHARD)fürsorge. ,chunk_3,
23875,2310.0,GR (SALZMANN),82539,82539 Gr Salzmann Sachs W Drude G Lebensversicherung technische Wörterbuch,82539GR (SALZMANN)er- buch. ,chunk_3,
23876,2391.0,SCHMID (P1),82996,82996 Schmid Pl Streiff Ulin Leitfaden zum neuen Artikevertragsrecht 1974,82996SCHMID (P1). (1974). ,chunk_7,
23877,2392.0,SCHMID (PL),83878,83878 Schmid PLSchircks Arnulf D Management Development und Führung Konzepte Instrumente und Präzisierung des strategischen und operativen Management Development Göttingen Verlag für Angewandte Psychologie 1994 24 cm V 308 S,"83878SCHMID (PL)m.V,308 S.",chunk_7,
23878,2393.0,SCHMID (PL),86794,86794 Schmid W PLSchönenberger Wilhelm Schweizerisches Zivilgesetzbuch vom 10. Dezember 1907 Textausgabe mit Anhängen Querverweisen Sachregister und Anmerkungen von W. S. und Peter Gauch in Zusammenarbeit mit Daniela Gmünder Perrig 40. Auflage,86794W.SCHMID (PL)0. Auflage,chunk_7,
23879,2394.0,SCHMID (PL),81468,8l1468 Di iKiiliü D Kühn Rene Aktuelles Arbeitsrecht für die betriebliche Praxis Stand Januar 1983 Zürich 1983 23cm Ordner,81468SCHMID (PL). Ordner. ,chunk_7,
23880,2395.0,SCHMID (PL),83227,83227 Schmid PL Flexibilisierung der Arbeitszeit Möglichkeiten Grenzen Konsequenzen Basel Schweizerische Kurse für Personalfragen Sekretariat 1992 24crA78 Bl,83227SCHMID (PL)ra.78 Bl. ,chunk_7,
23881,2396.0,SCHMID (PL),83247,83247 Sehmidt PL Müllner Wolfgang Privatisierung des Arbeitsplatzes Chancen Risiken und rechtliche Gestaltung der Telearbeit Stuttgart Richard Boorberg Verlag HMBH Co 1985 21 cm 196 S,"83247SCHMID (PL)1cm,196 S ",chunk_7,
23882,2397.0,SCHMID (PL),83399,83399 Schmid PL Uitrani Alain Dalziel Murray M» Strombach Manfred Human Resource Management Neue Konzepte zur Leistungssteigerung Landau/Lech Verlag Moderne Industrie 1992 25 cm 176 S,83399SCHMID (PL)cm.176 S. ,chunk_7,
23883,2398.0,SCHMID (PL),85049,85049 Schmid PL Heuer Walter Richtiges Deutsch Eine Sprachschule für jedermann Neu bearbeitet von Max Flückiger und Peter Gallmann 17. Auflage Zürich Verlag Neue Zürcher Zeitung 1985 23 cm 399 S,85049SCHMID (PL)m. 399 S. ,chunk_7,
23884,2399.0,SCHMID (PL),85055,85055 Schmid PL Lauer Hans Erhard Vom richtigen Altwerden Der menschliche Lebenslauf seine geschichtlichen Wandlungen und seine Gegenwartsprobleme Perspektiven der Anthropologie 55-60 Frankfurt am Main Fischer Taschenbuch Verlag GmbH 1985,"85055SCHMID (PL)feH, 1985)",chunk_7,
23885,2400.0,SCHMID (PL),85157,85157 Schraid PL Scmidhauser Thomas Stellensuche in härteren Zeiten Anleitung für die erfolgreiche Stellenbewerbung mit Briefbeispielen 2. Auflage Zürich Verlag des Schweizerischen Kaufmännischen Verbands 1985 21 cm 79 S,"85157SCHMID (PL)1cm,79 S. ",chunk_7,
23886,2421.0,BERTSCHINGER (P),84215,84215 Bertschinger P. Kernighan Brian V. Ritchie Dennis M. Programmieren in C. München Wien: Carl Hanser Verlag 1983. 23 cm XIII 262 S. Beilage in Falz,84215BERTSCHINGER (P) in Falz] ,chunk_0,
23887,2422.0,BERTUCH,7992,"Bertuch Fritz 7 W. Bertuch, Fritz und Wilhelm Jaehnicke. Das Deutsche Kreditabkommen von 1939 einschließlich der Sonderabkommen Schweiz Holland und Belgien vom September und Oktober 1939 mit einer Einführung in die Stillhaltung und erläuternden",7992FRITZBERTUCHläuternden,chunk_0,
23888,2423.0,BERUFE,93290,Berufe Berufe akademische in der Privatversicherung Herausg. Institut für Versicherungswirtschaft an der Hochschule St Gallen «i°li¹terau ag g I Ver band schweizerischer Versicherungsgesellschaften und Schweizerische Arbeitsgemeinschaft für,93290BERUFEschaft für,chunk_0,
23889,2424.0,BERUFE,83311,"Berufe E33 ff Berufe der technischen Informatik in der Schweiz Hrsg. Schweizer Automatik Pool SAP Autoren Andreas Dürste, Alan C. Hawkins u.a. Zürich VDF Verlag der Fachvereine an den Schweizerischen Hochschulen und Techniken 1992",83311BERUFE1992.     ,chunk_0,
23890,2425.0,BERUFE,91643,Berufe Berufe der Zukunft Die jüngste Generation auf dem Weg ins Jahr 2000 Hrg. von der La Suisse Lebens- und Unfallversicherungsgesellschaften Lausanne in enger Zusammenarbeit mit dem Schweizerischen Verband für Berufsberatung und Lehrlingsfürsorge,91643BERUFEngsfürsorg,chunk_0,
23891,2426.0,BERUFE-PANORAMA,,Berufe Panorama Berufe Panorama das Eine Dokumentation für junge Leute die vor der Berufswahl stehen a Rentenanstalt Das Berufe Panorama,BERUFE-PANORAMArama  ... ,chunk_0,
23892,2427.0,BERUFLICHE,,Berufliche Berufliche Vorsorge Neue Rechnungslegungs- und Anlageregulierung Vorschriften Regelung des Einsatzes der derivativen Finanzinstrumente Vorsorge berufliche Neue Rechnungslegungs- und Anlagevorschriften,BERUFLICHEiften ... ,chunk_0,
23893,2428.0,BERUFSBILDUNG,448,Berufsbildung 448 Berufsbildung in der Versicherungswirtschaft Jg. 1953 ff Beilage zu der Zeitschrift Versicherungswirtschaft Hannover 1953,448BERUFSBILDUNGer 1953 - ,chunk_0,
23894,2429.0,BERUFSHAFTPFLICHT,12536,Berufshaftpflicht Berufshaftpflicht die des Rechtsanwaltes « La responsabilité professionnelle de l'avocat » Schriftenreihe SAV Band 10 Zürich SAV Schweizerischer Anwaltsverband 1992 A 21cm 45 S G w,12536BERUFSHAFTPFLICHT45 S. G	w ,chunk_0,
23895,2430.0,BERUFSKUNDE,,Berufskunde Berufskunde des Handwerks Allgemeine Reihe Heft 15 a Heyn Walther Die Handwerkerversicherung 1948,BERUFSKUNDEg.„.	1948 ,chunk_0,
23896,2391.0,LUIDL,,Luidl Philipp s Handbuch Bruckmann 1 s der Drucktechnik Hrsg von I Brhardt DStietmer unter Mitarbeit von Johannes Determann PI,PHILIPPLUIDLI'    ... ,chunk_5,
23897,2392.0,LUKACS,72198,Lukacs Eugen Lukács E. Eugen Zur Theorie der Selektionstafeln Saad Skau dinavlsk Aktuarietidskrift 1939 Uppsala 1939 14 S,72198EUGENLUKACS.	(14 S.) ,chunk_5,
23898,2393.0,LUKARSCH,5132/30,Lukarsch Gerhard LukarschGerhard Das Institut für Versicherungswissen achaft der Universität München Sonderdruck aus Die Versicherungswissenschaft im Bereich der Wirtschafta und Sozialwisaenachaften des deutschen Sprachgebiets Schriftenreihe,5132/30GERHARDLUKARSCHftenreihe ,chunk_5,
23899,2394.0,LUKARSCH,5132/21,Lukarsch Gerhard o 3 Z ¿f Lukarsch Gerhard. Die Anwendung von Unternehmungsspielen in der Versicherungsbetriebslehre. Sonderdruck aus Versicherungswirtschaft 1964 Nr. 20. Schriftenreihe des Seminars für Versicherungsbetriebslehre an der Universität,5132/21GERHARDLUKARSCHder Univer,chunk_5,
23900,2395.0,LUKARSCH,5132/16,Lukarsch Gerhard Lukarsch Gerhard Innerbetriebliche Organisation und Betriebsgrosse in der Versicherungswirtschaft Schriftenreihe des Seminars für Versicherungsbetriebslehre an der Universität München Heft 16 München: Institut für Versicherungsw,5132/16GERHARDLUKARSCHicherungsw,chunk_5,
23901,2396.0,LUKARSCH,2464,Lukarsch Gerhard » £ » L Lukarsch Gerhard Die Kapitalanlagepolitik der privaten Lebensversicherung Unternehmen im Hinblick auf die Erstellung kaufkraftäquivalenter Versicherungsleistungen Frankfurter Wirtschafts- und Sozialwissenschaftliche,2464GERHARDLUKARSCHhaftliche ,chunk_5,
23902,2397.0,LÜKE,,L U k e Irene Luke Irene Luke Peter Turbo Pascal Grundlagen und Anwendungen für alle Implementationen Toolbox Turbo Lader Haar München Markt Technik Verlag 1985 24 cm A 290 S,IRENELÜKE A.	290 S ,chunk_5,
23903,2398.0,LÜKE,,Luke Peter s Luke Irene LP Turbo Pascal Grundlagen und Anwendungen für alle Implementationen,PETERLÜKEionen ... ,chunk_5,
23904,2399.0,LUKIC (CH/IX),87207,87207 Lukic Z CHIX Microsoft Office 97 Resource Kit Technical Information and Tools for the Support Professional Microsoft Professional Editions With 1 CD-ROM Redmond WA Microsoft Press 1997 23 cm XXX1151 p1 CD-ROM,87207Z.LUKIC (CH/IX)1 CD-ROM. ,chunk_5,
23905,2400.0,LUKIC (IN),83890,"83890 Lukic indi dokumente erstellen mit Electronic Publishing Systemen Autoren Brück, Brandt, Dieter Gust u.a. ITL Studie München: ITL Institut für Technische Literatur GmbH 1994 32 cm Ordner",83890LUKIC (IN)cm.Ordner.,chunk_5,
23906,2411.0,FINANZPLAN,91530,F inanzplan F inanzplan der revidierte des Bundes eine kritische Würdigung Zürich Aktionskomitee für einen sparsamen Bundeshaushalt 1977 21 cm 15 S,91530FINANZPLAN   15  S. ,chunk_2,
23907,2412.0,FINANZPLAN,7801,Finanzplan Finanzplanneuer und Steuergutsçieine BearbvReicheKreditGeeellBciiaft Aktiengesellschaft Berlin Als Manuskript gedruckt ohne Gewähr Berlin 1939 144 S 19392646,"7801FINANZPLAN939,2646. ",chunk_2,
23908,2413.0,FINANZPLATZ,91599,Inanzplatz Finanzplatz gegen Werkplatz VFP Report Berichte Hinweise Signale zur schweizerischen Finanzpolitik Nr. 6 Zürich Vereinigung für Finanzpolitik VFP Talstrasse 83 1979 21 cm 16 S,91599FINANZPLATZcm. 16 S. ,chunk_2,
23909,2414.0,FINANZPLATZ,85358,Finanzplatz Finanzplatz Schweiz Perspektiven Herausforderungen Chancen Eine Delphi-Umfrage zur Entwicklung des schweizerischen Bankwesens in den nächsten zehn Jahren Zürich Arthur Andersen AG 1986 30 cm 116 S 24627,85358FINANZPLATZ 24627	^< ,chunk_2,
23910,2415.0,FINANZPLATZ,91576,Finanzplatz Finanzplatz Schweiz der Bankverein Heft 6 Basel Schweizerischer Bankverein 1975 21 cm 61 S,"91576FINANZPLATZ,   6l S. ",chunk_2,
23911,2416.0,FINANZPLATZ,83635,Pinanzplatz Finanzplatz Schweiz im Jahr 2001 Die Zukunftstrends Schweizer Bank Broschüre Zürich Schweizer Handelszeitung 1994 30 cm 40 S 32052,83635FINANZPLATZ S. 32052 ,chunk_2,
23912,2417.0,FINANZREFORM,93136,Finanzreform Finanzreform die Herausg. Hans Nawiasky Veröffentlichungen der Schweizerischen Verwaltungskurse an der Handels-Hochschule St Gallen Band 11 Einsiedeln Köln Benziger 1948 253 S K 1151,93136FINANZREFORM S K 1151 ,chunk_2,
23913,2418.0,FINANZ-REVUE,,Finanz Revue F 1 Nahr Z Revue Jg. 1919 39 ff. Zürich 1939 A,FINANZ-REVUE939 - * A ,chunk_2,
23914,2419.0,FINANZWIRTSCHAFT,,Finanzwirtschaft Finanzwirtschaft und Finanzrecht Band 1 s Besteuerung der juristischen Personen und Steuerharmonisierung in der Schweiz,FINANZWIRTSCHAFT Schweiz. ,chunk_2,
23915,2420.0,FINCK,,Finck Théo Schiess H Finck Théo Schiess H. Der Erweiterungsbau des Zürcher Kunsthauses,THÉOFINCKsthauses. ,chunk_2,
23916,2321.0,CODY,7454,"Cody Slierwin Cody Slierwin. Lart de faire des affaires par lettre et par annonce. Méthode scientifique appliquée à la correspondance et à la publicité. Traduit par L. Chambonnaud. Paris: HBunod E. Pinal, 1912. 291 p. 950",7454SHERWINCODY p.) 950. ,chunk_1,
23917,2322.0,COE,3629,Coe N E Coe N E Ogborn M E The practice of life assurance Cambridge University Press 1952 X 440 p Von Prof Marchand,3629N.E.COE.Marchand ,chunk_1,
23918,2323.0,COELHO,,Coelho Maurice Bernard i Coelho Maurice Bernard Praktisch verklärend zakwoordenboek der geneeskunde 5e druk door G. Kloosterhuis 1956 s' Gravenhage G. van Goor Zonens Uitgevermaatschappij 670 p 4746 W 4,MAURICE BERNARDCOELHO        4 ,chunk_1,
23919,2324.0,COEN,,Coen Eleonore s Vereinigung schweizerischer Bibliothekare Bibliotheken in der Schweiz,ELÉONORECOEN Schweiz. ,chunk_1,
23920,2325.0,COENENBERG,,Coenenberg Adolf G. S. Controlling und Rechnungswesen im internationalen Wettbewerb Hrsg. von Clemens Börsig und ACG,ADOLF G.COENENBERG.C1   ... ,chunk_1,
23921,2326.0,COERT,,Coert J. Coert J. Die Unterleibssbrüche und die Unfallversicherung 00 u 19 6 • DT,J.COERT    (DT.) ,chunk_1,
23922,2327.0,COFFRON,,Coffron James W. Coffron James W. Programmierung der 80868088 2. Auflage Düsseldorf Berkeley London Paris SYBEX Verlag GmbH 1985 A 21C1Q307 S PROVISORIUM,JAMES W.COFFRONOVISORIUM ,chunk_1,
23923,2328.0,COGNARD,94712,"Cognard Pierre Cognard, Pierre. Der wissenschaftliche und technologische Fortschritt der USA. Lausanne Zentrum für europäische Forschungen 1967. 42 S.",94712PIERRECOGNARD. (42 p.) ,chunk_1,
23924,2329.0,COHEN,,Cohen Victor N. S. Auf was es beim Gestalten ankommt Denkanstöße Erkenntnisse Fragen und Vorschläge aus dem Nachlass von VNC,VICTOR N.COHEN V'N'C'	^ ,chunk_1,
23925,2330.0,COHN,,Cohn Georg Cohn Georg Hans Rudolf Thirn Eisen Saad Archiv für bürgerliches Recht Bd 35 00191 9 S.I. Prof. Dr.,GEORGCOHNProf.Dr.) ,chunk_1,
23926,2381.0,PETER,94231,Peter FX 94231 Peter X Auslieferung deutschen Privat eigen turne Zürichleemann 1946 31 S K 155 Rechtsanwalt,94231F.X.PETERt)      - ,chunk_6,
23927,2382.0,PETER,7064/49,Peter Gottfried PeterGottfried Wechsel und wechselähnliche Papiere unter spezieller Berücksichtigung der Schweiz Gesetzgebung Mit 7 Beil Biel: EKulm 1901 IV 42 S,"7064/49GOTTFRIEDPETERIV,42 S.) ",chunk_6,
23928,2383.0,PETER,,Peter Hans Jahre hundert Schweizerisches Obligationenrecht Jubiläumsschrift hrsg. im Auftrag der Juristischen Fakultäten der Schweiz von HPI,HANSPETER H'P1 ... ,chunk_6,
23929,2384.0,PETER,94471/6,Peter Hans t f u Peter Hans Salomon Volkart 1816–1893 Schweizer Pioniere der Wirtschaft und Technik Bd. 6 Zürich: Verein für Wirtschaftshistorische Studien 1956 21 S. K 4126,94471/6HANSPETER) K  4126 ,chunk_6,
23930,2385.0,PETER,84437,P e t e r K. Peter K. ABC der abzugfähigen und nichtabzugfähigen Ausgaben 10. vollständig erneuerte Auflage Herne: Berlin Verlag Neue Wirtschaftsbriefe 1975 22 cm 795 S 15117,84437K.PETER S. 15117 ,chunk_6,
23931,2386.0,PETER,81143,Feters Laurence J Peter Laurence J Hull Raymond Das Peter Prinzip oder Die Hierarchie der Unfähigen Aus dem Amerikanischen übersetzt von Michael Jungblut 139148 Tausend rororo Sachbuch 6793 Reinbek b Hamburg Rowohlts Taschenbuch,81143LAURENCE J.PETERwohlt (Tas,chunk_6,
23932,2387.0,PETER,5691,Peter Laurence J 5é j Peter Laurence J Das Peter Programm Der 66 Punkte Plan mit dem man Problemen Pannen und Pleiten Paroli bieten kann Deutsch von Kurt Wagenseil Titel der amerikanischen Originalausgabe The Peter Prescription How t,5691LAURENCE J.PETERion. How t,chunk_6,
23933,2388.0,PETER,5641,Peter Laurence J. Hull Raymond Das Peterprinzip oder die Hierarchie der Unfähigen Deutsch von Michael Jung Blut Reinbeck bei Hamburg Rowohlt Verlag 1970 8° 222 S 10955,5641LAURENCE J.PETER S. 10955 ,chunk_6,
23934,2389.0,PETER,12456,Peter Walter Peter Walter Hof Eane Bauenrechtliche Sofortmaßnahmen im Siedlungsbereich Erläuterungen zu den Bundesbechlichten Ufter Sperrfrist Pfandbelastungsgrenze und Auflage vorm 6 Oktober 1989 Han,12456WALTERPETER 1989. Han,chunk_6,
23935,2390.0,PETER,94459,Peter Werner • Peterfferner Das Vorschlagswesen Ein Beitrag zu einer erfolgreichen Betriebsgemeinschaft und zur Hebung der Wirtschaftlichkeit Unternehmung und Betrieb Band 7 Bern Haupt 1946 48 S G 492,94459WERNERPETERS.) G 492 ,chunk_6,
23936,2411.0,X. WINDOW,,Z WindowZ Windows System Series Toils Nye Adrian Zlifc Programming Manual for Version 11 of the Z Window System,X. WINDOWSystem ...,chunk_9,
