id,field_id,titel_autor,rasignatur,volltext,unique_key,file,field
23493,2386.0,BERTSCHI (AD),84978,84978 Bertschi AD Handbuch Bruckmann 1. s. der Drucktechnik Hrsg. von Erhard D. Stietmer 3. Auflage München Verlag P. Bruckmann KG 1981 25 cm 302 S,84978BERTSCHI (AD)m.302  S. ,chunk_0,
23494,2387.0,BERTSCHI (AD),83005,85005 Bertschi Ad Handbuch der Werbeproduktion 6. Jahrgang 1983 Zurieft Media Daten AG 1983 30 cm 168 S,83005BERTSCHI (AD)0cm.168 S ,chunk_0,
23495,2388.0,BERTSCHI (AD),85589,85589 Bertschi AD VHausinold Stünzi Heinz Marketing in 20 Lektionen 14. Auflage St. Gallen Fachmed Verlag 1988 24 cm 640 S,85589BERTSCHI (AD)m.640  S. ,chunk_0,
23496,2389.0,BERTSCHI (AD),85707,85707 Bertschi AD Brunn Manfred Sponsoring Unternehmen als Mäzene und Sponsoren Frankfurt am Main Frankfurter Allgemeine Wiesbaden Gadler 1987 22 cm 296 S,85707BERTSCHI (AD)cm.296 S. ,chunk_0,
23497,2390.0,BERTSCHI (AD),84814,84814 Bertschi Ad Guide du typographe romand 4e édition Lausanne Le Groupe de Lausanne de l'Association suisse des compositeurs à la machine 1982 23 cm 173 p,"84814BERTSCHI (AD)cm,173 p. ",chunk_0,
23498,2351.0,LOWES,,"27. Brück, E. Brück, E. Reichsgesetz über den Versicherungsvertrag nebst dem zugehörigen Einführungsgesetz Vom 30. Mai 1908. 7. Auflage Guttentagsche Sammlung Deutscher Reichsgesetze Nr. 83 Berlin: W. de Gruyter & Co. 1932. (VIII, 563, 56 S.)","BRYANLOWES, B'L1 .. ",chunk_5,
23499,2352.0,LOYERS,,"Entsprechend der Vorschriften der Gesetzgebung über die Mieten
Loyers sur la législation des loyers",LOYERSes loyers ,chunk_5,
23500,2353.0,LOYNES,,Loyn e B P de Saint Baudry. Iacantinérie Göp de. Traité théorique et pratique de droit civil 1899 715,P. DELOYNES 1899 715 ,chunk_5,
23501,2354.0,LOYO,,Loyo Gilberto Loyo Gilberto s Bojorquez Juan de Dios et G I Sobre estadísticas internacionales de los efectos protestados 1937,GILBERTOLOYO    1937. ,chunk_5,
23502,2355.0,LPP,,L P P LPP la après l élimination des divergences par le Conseil national Tableau synoptique contenant la teneur du Conseil des Etats du 16 juin 1960 et celle du Conseil national du 30 septembre 1981 Tirage à part de la RCC 198110 Berne Office fé,LPP Office fé,chunk_5,
23503,2356.0,LUBER,82520,Luber Franz Q Luber » Franz Deutsche Sozialgesetze Sammlung des Sozialrechts der Bundesrepublik Loseblattform mit Ergänzungslieferungen X Nicht mehr weiter geführt Münchener Verlag RS Schulz 1967 ••r J 9286 J1,82520FRANZLUBER9286	~ J1 ,chunk_5,
23504,2357.0,LUBER,105,Luber Franz F. Ioh. Luber Franz Fundstellen und Inhaltsnachweise Arbeits- und Sozialrecht Stand 30. Juni 1973 Beilage zur Sammlung Deutsche Sozialgesetze Obercha am Starnberger See Verlag R. S. Schulz 1973 13274,105FRANZLUBER.-) 13274 ,chunk_5,
23505,2358.0,LUBICZ (GS),81901,81901 Lubicz Gs Robert Paul Dictionnaire alphabétique et analogique de la langue française Le Petit Robert Paris 1979,81901LUBICZ (GS))   1979. ,chunk_5,
23506,2359.0,LUBIN,,Ubin J Tatoles numériques donner la valeur des capitaux différés et des annuités temporaires sur deux têtes de même âge variant dannee en année de 25 à 89 ans Tables AF et RF taux Parie Dula c 1908 41 S s,J.LUBIN41 S.) <s ,chunk_5,
23507,2360.0,LÜBSEN,,Lüssen H. B. Kibsen H. B. Ausführliches Lehrbuch der Arithmetik und Algebra zum Selbstunterricht und mit Rücksicht auf die Zwecke des praktischen Lebens 3. A. Hamburg: Perthes Besser Se Mauke 1853. 15254 S. 373 K,H. BLÜBSEN373	^ $ K ,chunk_5,
23508,2281.0,CODE,1649,Code de procédure pénale du canton de Vaud du 1er février 1850 avec les modifications qui lui ont été apportées jusqu'au 31 décembre 1936 Extrait de la loi du 5 septembre 1933 sur les routes Lehmann Roth Cie 1937 93 S,1649CODE-	(93 S.) ,chunk_1,
23509,2282.0,CODE,83250,Code des assurances à jour au 1er mai 1991 1 exception des commentaires des textes de la partie 1 à jour au 1er juillet 1989 8e édition commentée par Jean Bigot André Pointeau Éditions Paris L’Argus 1991 24cm 1037 p 30522,83250CODE. 30522	. ,chunk_1,
23510,2283.0,CODE,85408,Code des assurances 6e édition annotée entièrement révisée par Gilbert Croguez Paris L'Argus 1987 24 cm XXXVII 992 p 24793 Köln SWK,85408CODE Keln SWK ,chunk_1,
23511,2284.0,CODE,16009,Code des assurances 5. Edition annotée revue et augmentée par Guy Courtieu et Gilbert Croquier Paris L'Argus 1985 24 cm XXXVIII 1988 p 22813,16009CODE          ,chunk_1,
23512,2285.0,CODE,16007,"Code des Assurances 2 Tomes
Edition mise à jour au 1er juillet 1980 avec suppléments
L'état 21 mai 1981
Tome I Parties législative et réglementaire
Arrêtés
Index alphabétique
Tome II Livre III
Titre IV Dispositions comptables et statistiques",16007CODEstatistiqu,chunk_1,
23513,2286.0,CODE,70495,Code des obligations Loi fédérale complétant le Code civil suisse Livre cinquième Droit des obligations Du 30 mars 1911 18 décembre 1936 Édition officielle Berne 1957 318 S 1942 3636,"70495CODE942,3636. ",chunk_1,
23514,2287.0,CODE,7563,Code des obligations loi fédérale complétant le Code civil suisse. Livre VDroit des obligations. Du 30 mars 1911. Berne 1911. 271 p.,7563CODE	(271 p.) ,chunk_1,
23515,2288.0,CODE,81102,Code 81102 Code du timbre accompagné de tables analytique et alphabétique et de tables de référence 1er novembre 1946 Ministère des Finances Direction générale de lEnregistrement des Domaines et du Timbre Paris Imprimerie nationale 1947,81102CODE 1947.    ,chunk_1,
23516,2289.0,CODE,1173,Code »Code fédéral des obligations du 14 juin 1881 et loi fédérale sur la capacité civile du 22 juin 1881 2éd BeraeKJWyse 1882 183 p •,1173CODE183 p.) • ,chunk_1,
23517,2290.0,CODE,1152,Code Code fédéral suisse des obligations complété par indication des changements y porté lors de ladoption de la loi en Turquie Par Georg Wettstein Zurich J. Bollmann 1928 400 p 1571,1152CODE p.) 1571 ,chunk_1,
23518,2371.0,FICK,,Fjok Fjock Fjock. Die verschleierte und eichelberliarte Gründung von Aktiengesellschaften Schweizer Zeitfragen Heft 57 Zürich Art Institut Grell Püssli 1922 8 S. 1122 9 Dr.,F.FICK    (Dr.) ,chunk_2,
23519,2372.0,FICK,7859,Fick Fick Versicherungsrechtliche Abhandlungen Bd I Die bei der Auslegung des Versicherungsvertragsrechte maßgebenden Grundsätze insbesondere nach schweizerischem Recht Zürich Art Inst Orell Füssli 1917 49 S 5725 Dr,7859F.FICK25.	(Dr.) ,chunk_2,
23520,2373.0,FICK,,"Fick Friedrich Fick, Friedrich. Der juristische Charakter des Lebensversicherungsvertrages. Dise. Univ. Zürich: Zürich J. Schabelitz 1884. 68 S. 56 B W",FRIEDRICHFICK        ' ,chunk_2,
23521,2375.0,FICK,,Fick Hs Schneider Auf Das schweizerische Obligationenrecht 2 A 1896 709,H.FICK1896. 709 ,chunk_2,
23522,2376.0,FICK,,Fick » Heinrich Fick Heinrich. Ob Selbsttötung in unzurechnungsfähigem Zustande von Lebensversicherungsanstalten als Befreiungsgrund geltend gemacht werden könne 00 187 47 S 58 B ™ Prof. Dr. A,HEINRICHFICK        A ,chunk_2,
23523,2377.0,FID-COMMUNICATIONES,,423. FID-Communicationes 8 Revue de la documentation,FID-COMMUNICATIONESmentation ,chunk_2,
23524,2378.0,FIDUCIA,,Fiducia Fiducia Zeitschrift für das gesamte Gebiet des Revisionswesens und der Betriebswirtschaft in der Schweiz Offizielles Organ des Verbandes Schweiz Bücherexperten Jg. 25 1951 Heft 7 ff 28 1954 Heft 4 Fortsetzung Bulletin des Verbandes Schweiz,FIDUCIAd[es] schw,chunk_2,
23525,2379.0,FIEDLER-WINTER,,Fiedler Wolfgang Fiedler Winter Rosemarie Flexible Arbeitszeiten Beispiele aus der Praxis Landsberg Lech Verlag Moderne Industrie 1995 A 22 cm 257 S 33751,FIEDLER-WINTER S. 33751 ,chunk_2,
23526,2380.0,FIEGER,,Fieger Erwin Ski-Weltmeisterschaften St. Moritz 1974,ERWINFIEGERitz  1974 ,chunk_2,
23527,2361.0,SCHMID,94337,Schmid Werner 94337 Schmid Werner Das feste Grundkapital der Aktiengesellschaft Zürcher Beiträge zur Rechtswissenschaft NF Heft 146 Aarau Sauerländer 1948 17145 S 201,94337WERNERSCHMID5 S.) 201 ,chunk_7,
23528,2362.0,SCHMID (C?/U2),86862,86862 Schmid Peter und Weber Lukas. Integriertes Leistungsmanagement in der Versicherung. Diss. Univ. St. Gallen. Schriftenreihe des Instituts für Rechnungslegung und Controlling Band 1. Verlag Paul Haupt 1995. 23 cm XXI 341 S.,"86862PETER E.SCHMID (C?/U2)XXI,341 S.",chunk_7,
23529,2363.0,SCHMID (CH/ITPR),87603,87603 H. P. Schmid CHITPR Graham Ian S. Henderson Sellers Brian Younessi Houman The OPEN process specification The OPEN series Reading MA Addison Wesley Longman Limited 1997 25 cm XXI 314 p,"87603H.P.SCHMID (CH/ITPR)XI,314 p. ",chunk_7,
23530,2364.0,SCHMID (CH/ITPR),88232,88232 H P Schm Li CHITPR Cockburn Alistair Surviving object-oriented projects A manager's guide 2nd printing. The Addison Wesley Object Technology Series Reading MA Addison Wesley Longman Inc 1998 24 cm XXI 250 S.,"88232H.P.SCHMID (CH/ITPR)XXI,250 p ",chunk_7,
23531,2365.0,SCHMID (CH/ITPR),88233,88233 HP Schmid CHITPR Rumbaugh James Jacobson Ivar Booch Grady The Unified Modeling Language Reference Manual The Addison Wesley Object Technology Series Reading MA Addison Wesley Longman Inc 1998 24 cm XVII 550 S. 1 CD-ROM,88233H.P.SCHMID (CH/ITPR)1 CD-ROM. ,chunk_7,
23532,2366.0,SCHMID (CH/ITPR),88234,88234 HP Schmid CHITPR Jacobson Ivar Booch Grady Rumbaugh James The Unified Software Development Process The Addison Wesley Object Technology Series Reading MA Addison Wesley Longman Inc 1999 24cm XXIX 463 S.,"88234H.P.SCHMID (CH/ITPR)IX,463 p. ",chunk_7,
23533,2367.0,SCHMID (CH/ITPR),88235,832J5 HP Schmid CHITPR Booch Grady Rumbaugh James Jacobson Ivar The Unified Modeling Language User Guide 3rd Printing The Addison-Wesley Object Technology Series Reading MA Addison Wesley Longman Inc 1999 24 cm XXII 482 S.,"88235H.P.SCHMID (CH/ITPR)II,482 p. ",chunk_7,
23534,2368.0,SCHMID (CH/ITPR),88236,88236 HP Schmid CHITPR Royce Walker Softwareprojektmanagement Ein einheitlicher Rahmen Die Addison-Wesley Objekttheorie-Serie Reading MA Addison-Wesley Longman Inc 1998 24 cm XXVIII 406 S.,"88236H.P.SCHMID (CH/ITPR)II,406 p. ",chunk_7,
23535,2369.0,SCHMID (CH/ITSC),87910,87910 H. P. Schmid CHITS Allen Paul Frost Stuart Component-based development for enterprise systems applying the SELECT Perspective Managing object technology series New York Cambridge University Press SIGS Books Multimedia 1998 2,87910H.P.SCHMID (CH/ITSC) 1998).	-2,chunk_7,
23536,2370.0,SCHMID (CH/ITSC),87911,"87911 H. P. Schmid CHITSCS Software-Architecture-Pattern-orientiertes Mustersystem von Frank Buschmann, Regine Meunier o. A. Siemens AG Deutschland Reprint Chichester UK John Wiley & Sons Ltd 1998 25 cm XVI 467 S.","87911H.P.SCHMID (CH/ITSC)XVI,467 p.",chunk_7,
23537,2341.0,PERSONALVORSORGE,2849,Personalvorsorge Personalvorsorge Prévoyance en faveur du personnel Mitteilungen des Interkantonalen Verbandes für Personalvorsorge Hr. 33. März 1974 Nr. 43. Juni 1985 Forts. Personalfürsorge 1955/1971. Forts. Mitteilung,2849PERSONALVORSORGE:   Mittei,chunk_6,
23538,2342.0,PERSONALVORSORGE,2470,Personalvorsorge • Personalvorsorge die betriebliche im Steuerrecht von Bund und Kantone Herausgeber Schweizerischer Kaufmännischer Verein Zürich 1968 15 S,2470PERSONALVORSORGE.	(15 S.) ,chunk_6,
23539,2343.0,PERSONALVORSORGE,2462,Personalvorsorge Personalvorsorge ein Gebot der Stunde Appell und Wegweiser Herausgegeben Schweizerischer Kaufmännischer Verein Zürich 1969 21 cm 28 S 11523,2462PERSONALVORSORGE8 S 11523 ,chunk_6,
23540,2344.0,PERSONALVORSORGE,93304,Personalvorsorge 3 o C Pensionsvorsorge Freizügigkeit Policen Zürich Sentralstelle des Pools Schweizerischer Lebensversicherungsgesellschaften für Freizügigkeitspolicen 1972 22 cm 9 S,93304PERSONALVORSORGE.   9  S. ,chunk_6,
23541,2345.0,PERSONALVORSORGE,ORD. 198,Personalvorsorge Personal Vorsorge und Steuern Apropos Nr 62 Basel Schweizerische Treuhandgesellschaft 1987 T 3000115 S,ORD. 198PERSONALVORSORGE0001.15 s ,chunk_6,
23542,2346.0,PERSONALWESEN,82825,Personalwesen S. Z. Personalwesen das in der Zukunft Ein Kongressbericht Referate die anlässlich des 4. Kongresses der Europäischen Vereinigung für Personalfragen im Juni 1969 in München gehalten wurden Neuwied: Berin: Luchterhand Verlag 1970,"82825PERSONALWESENrlag,1970.",chunk_6,
23543,2347.0,PERSONALWOHLFAHRTSAUFWENDUNGEN,5116/20 21,Personalwohlfahrte auf Wendungen Personalwohlfahrtsaufwendungen die in der Zürcherischen Wirtschaft Separatabdruck aus dem Jahresbericht 1954 der Zürcher Handelskammer Zürich 1955 23 S. K. 3505 W,5116/20 21PERSONALWOHLFAHRTSAUFWENDUNGEN        W ,chunk_6,
23544,2348.0,PERSONEN,,Personen Personen natürliche Gemeinden « Personnes physiques Communes Direkte Bundessteuer Veranlagungsperiode 1983 1984 Bern » Eidgenössische Steuerverwaltung 1987 Kein SWK,PERSONEN Kein SWK ,chunk_6,
23545,2349.0,PERSONEN,1753,Personen J X Personen und Gesellschaftsrecht das PGR vom 20. Jänner 1926 und das Treuhundunternehmen über Geschäfts treuhand Tr U vom 10. April 1928 Art 932a Vaduz Verlag der Regierungskanzlei 196,"1753PERSONENei, 196?. ",chunk_6,
23546,2350.0,PERSONEN-,87736,Personen Personen- und Gesellschaftsrecht des Fürstentums Liechtenstein mit dem Gesetz über das Treuunternehmen samt Verordnung vom 20. Februar 1926 zum PGR Verordnung vom 14. Juni 1980 zum PGR und Verordnung vom 26. April 1994 über die Aufzeichnung,87736PERSONEN-fzeichnung,chunk_6,
23547,2271.0,TELSCHOW,,Telsctiow Ingo s Albrecht Peter T. Integrierte Markt- und Risikosegmentierung in einem deregulierten Versicherungsmarkt,INGOTELSCHOWngsmarkt. ,chunk_8,
23548,2272.0,TELSCHOW,,Telechow R. Telsoliow R. Der gesamte Geschäftsverkehr mit der Reichsbank Ein Handbuch zur Orientierung für das Publikum. Leipzig: Gloeckner 1900. 270 S.,RTELSCHOW	(270 S.) ,chunk_8,
23549,2273.0,TELSWISS,,Telawiß Telswiss 1966 Telefonbuch der Schweiz für Industrie Handel und die Werbung Annuaire téléphonique de la Suisse pour l'industrie le commerce et l'artisanat Elenco telefonico della Svizzera per l'industria il commercio e l'artigianato,TELSWISSmercio e 1,chunk_8,
23550,2274.0,TEMPERLI,,Temperli »Heinrich. Temperli Heinrich. Über Aufbau und Einrichtung von Pensionsversicherungen. Vortrag St. Gallen Selbstverld. Verf. 1941 15 S. 1944 4800 W. Prof. Dr.,HEINRICHTEMPERLI •        ,chunk_8,
23551,2275.0,TEMPERLI,7095,Temperli T Hermann J. Temperli Hermann. Die rechtliche Natur der industriellen Pensionskassen nach schweizerischem Obligationenrecht. Abhandlungen zum schweizerischen Recht NF. Heft 156. Bern: Stämpfli Cie 1939. VI88 S. 1940 2850 Dr.,7095HERMANNTEMPERLI50.	(Dr.) ,chunk_8,
23552,2276.0,TEMPS,,Temps Tempele Année 1941 Lyon 1941 A,TEMPS1941- A	: ,chunk_8,
23553,2277.0,TEN PAS,3266,Tena Pa a W G J 3 tot 6 Ten Pas W G J Exploitatie en rendement van onroerende goederen ISA Verzekeringsarchief 1941 s'Gravenhage 1941 49 S,3266TEN PAS49 S.) ™  ,chunk_8,
23554,2278.0,TEN PAS,72136,e n P a s W Ten Pasïï G J Over de grondslagen eener mathematische statistiek van eterfte SA Verzekering Barchiefdeel XIX B. Gravenhage 193 19 3,72136TEN PAS.	(19 3.) ,chunk_8,
23555,2279.0,TEN PASTENBRUCK,,Tenbruck F. H. i Gegenwartafragensoziologische Neue Folge Herausgegeben von L. Neundörfer.HSchelsky F. H. T. Nr. s Kaufmann Franz Xaver Sicherheit als soziologisches und sozialpolitisches Problem,F.H.TEN PASTENBRUCK Problem. ,chunk_8,
23556,2280.0,TENDANCES,84883,Tendances Tendances à long terme des recettes fiscales des pays membres de l'OCDE 1955 1980 Études fiscales de l'OCDE Paris Organisation de coopération et de développement économiques 1981 A 27 cm 43 p 21281,84883TENDANCES3 p 21281 ,chunk_8,
23557,2371.0,WYSS,2079,Wys Sj Hans Wyss Hans Schweizerische Lebensversicherungs- und Rentenanstalt 1857-1957 Illustr. Zürcher NZZ 1957 249 S Prof. Dr.,2079HANSWYSS.)Prof.Dr.,chunk_9,
23558,2372.0,WYSS,70636,Wysß Hans o ¿3ï ï y8 Hans Finanzierungsverfahren in der Lebensversicherung Schweiz Versicherung Z Jg 23 1955 Nr 4 S 97 110,70636HANSWYSSS. 97-110.,chunk_9,
23559,2373.0,WYSS,91180,Hansüss Hansüss Hansüß Hans Umlage und Deckungsverfahren bei Lebensversicherungs-Einrichtungen Vortrag gehalten an der Hauptversammlung vom 21. Mai 1954 In Zum Problem der Finanzierung von Pensionskassen Zürich Schweizerischer Verband für privat,91180HANSWYSS fUr priva,chunk_9,
23560,2374.0,WYSS,5121/44,Wys Hans W. Wys Hai i 3 Las Versicherungswesen im Handelsfachunterricht Wach einem Vortrag an der 50-Jahresversammlung der Schweizerischen Gesellschaft für kaufmännisches Bildungswesen SAad Schweizerischen Versicherungs Zeitschrift,5121/44HANSWYSS tschrif t,chunk_9,
23561,2375.0,WYSS,5121/48,Wyss Hans Wyss Hans Die Risikotheorie und ihre Bedeutung für die Versicherungsmathematik. Zeitschrift der Vereinigung schweizerischer Versicherungsmathematiker 1953 Bern: Stämpfli 1953. 23 S.,5121/48HANSWYSS3.	(23 S.),chunk_9,
23562,2376.0,WYSS,91388,Wyss Hans Wyss Hans Die gegenwärtigen Formen der Einzelkapitalversicherungen bei den schweizerischen Lebensversicherungsgesellschaften Auszug aus einem Referat Zürich 1951 27 S,91388HANSWYSS   (27 S.),chunk_9,
23563,2377.0,WYSS,2974,Wyss Hans Hans. Erfüllt die private Lebensversicherung ihre Aufgabe Auszug aus einem Vortrag Zürich 1951 43 S,2974HANSWYSS1.	(43 S.),chunk_9,
23564,2378.0,WYSS,5121/25,Wyss Hans Wyss Hanse Mathematik und Solidarität S A Schweizerische Versicherungs Zeitschrift 1949 Nr 4 Bern Lang 1949 16 S. A Dr j Privatdozent,5121/25HANSWYSSent)   />*,chunk_9,
23565,2379.0,WYSS,5120/32,Wyss Hans Wyes Hans Erwägungen über abhängige und unabhängige Wahrscheinlichkeiten SAad Mitteilungen der Vereinigung schweizerischer Versicherungsmathematiker 1948 Heft 2 Bern Stampfli 1948 35 SG 187,5120/32HANSWYSS          ,chunk_9,
23566,2380.0,WYSS,70635,Wyss Hans Wyss Hana Verstärkung der Gruppenversicherungstarife für Letzendenfallversicherungen SAad Mitteilungen der Vereinigung Schweizerischer Versicherer Bd. 45 Heft 1 Bern Stämpfli 1945 7 S 19455568,70635HANSWYSS          ,chunk_9,
23567,2391.0,JONES,3549,Jones David Jones David. Leibrenten und Lebensversicherungen Deutsch bearbeitet mit Tabellen versehen von Karl Hattondorff Hannover. Hahn 1859 VIII 317 S A 193,3549DAVIDJONESS.) A 193 ,chunk_4,
23568,2392.0,JONES,,Jones John E. S. Pfeiffer J. William J. Arbeitsmaterial zur Gruppendynamik,JOHN E.JONESnamik ... ,chunk_4,
23569,2393.0,JONES,4340,Jones Lawrence D 3 UQ Jones Lawrence D Investment policies of life insurance companies Boston Division of Research Graduate School of Business Administration Harvard University 1968 8° XXI 568 p 10409,"4340LAWRENCE D.JONESp., 10409 ",chunk_4,
23570,2394.0,JONES,7828,Jones Ralph C. Jones Ralph C. Méthodes de comptabilité applicables à la ventilation du revenu imposable des entreprises Inau e JK libres limposition des entreprises étrangères et nationales vol Genève Société des Nations 1933 87 S 2,"7828RALPH CJONES(87 S.,) 2",chunk_4,
23571,2395.0,JONES F,3870,Jones Robertson Jones F. Robertson. History and Proceedings of the World’s Insurance Congress San Francisco Gal 1915 with a review of preliminary events from 1910 to 1915 New York 1917 fol XVIII 599 S. A. Q.,3870ROBERTSONJONES F          ,chunk_4,
23572,2396.0,JONGEWARD,,Jongeward Dorothy s James Mûrie JD1 Spontan leben Übungen zur Selbstverwirklichung,"DOROTHYJONGEWARDg   , . . ",chunk_4,
23573,2397.0,JONGH,,Jongh B. H. B. S. Campaigne C. B. H. de J. in J. N. S. Mit Beitrag zur der mathematischen Theorie von der Betriebsreserve und dem Eigentum in der Brandversicherung,B. H.JONGHzekering. ,chunk_4,
23574,2398.0,JONSSON,,Jonsson Patriks Jacobson Ivar Griss Martin JP Software reuse Architecture process,"PATRIKJONSSON, process ",chunk_4,
23575,2399.0,JOOS,BD I: 1233  BD II: 6711,Joos Robert » ff Joos Robert Handbuch für die Betreuungsbeamten der Schweiz mit Formularmuster Band Wädenswil: A. Stutz 1964. Bd I 415 S. Bd II Formulare,BD I: 1233  BD II: 6711ROBERTJOOSormulare) ,chunk_4,
23576,2400.0,JORDAN,,Jordan Chester Wallace Jordan Chester Wallace Society of Actuaries textbook on life contingencies Second edition Chicago Illinois Society of Actuaries 1975 24 cm XI 390 p G Rück,CHESTER WALLACEJORDANp. G Rück ,chunk_4,
23577,2271.0,GÖPPERT,,"Göppert Heinrich Göppert, Heinrich. Die Bedeutung der Worte Darlehen Über die Schuldscheine ausgestellt sind im § 30 Abs. 3 des Anleiheablösungsgesetzes Bonn Hofdruckerei Carthusian 1927 S. 16369 Prof. Dr. JV",HEINRICHGÖPPERT.Dr.) JV< ,chunk_3,
23578,2272.0,GÖPPL,,Göppl Hermann s Geld Banken und Versicherungen 1984 Band II Beiträge zum 3. Symposium Geld Banken und Versicherungen an der Universität Karlsruhe vom 12-15 Dezember 1984 Hrsg von HG1,HERMANNGÖPPL H'G1 ... ,chunk_3,
23579,2273.0,GORDON,4495,Gordon Thomas Gordon Thomas Managerkonferenz Effektives Führungs training Aus dem Amerikanischen übersetzt von Hainer Kober Hamburg Hoffmann und Carape Verlag 1979 21 cm A 272 S. Abb,4495THOMASGORDON72  S.Abb ,chunk_3,
23580,2274.0,GORECKI,5306,Gorecki Roman Gorecki Roman Olens Wirtschaftliche Entwicklung 2A Warschau Landeswirtschaftsbank 1955 70 S F A,5306ROMANGORECKI) -f/<	/a ,chunk_3,
23581,2275.0,GOREN,L.,Goren Simon L s Swiss Federal Code of Obligations as of January 1 1984 by SLG1,L.SIMONGOREN S'L.G1 . ,chunk_3,
23582,2276.0,GÖRIG,,Görig A. Görig A. Ein Weg zur Analyse der Invaliditätsanwartschaften. Saad Skandinavisk Aktuarietidskrift 1920 Uppsala 1920 92 S.,A.GÖRIG^       u ,chunk_3,
23583,2277.0,GÖRING,,Goring Emil Goring Emil. Die Sterblichkeit anormaler Risiken beim Zusammenwirken mehrerer Minderwertigkeitsursachen Mitteilungen Schweizer Versicherungsmathematiker Heft 25 Bern: Stämpfli 1930 S. 171-201 Dr.,EMILGÖRING01) (Dr.) ,chunk_3,
23584,2278.0,GÖRING,,Göring E. Göring E. Überlegungsformeln zur Kontrolle der Reserve ganzer Versicherungsbestände Mitteilungen Schweizer Versicherungsmathematiker Heft 11 Bern: Stämpfli 1916 S. 1136 Dr. Köln,"E.GÖRINGDr.,Köln) ",chunk_3,
23585,2279.0,GORLEN,86397,Gorlen Keith E. Gorlen Keith E. Jr. Orlow Sanford M. Pleiico Perry S. Data abstraction and object-oriented programming in C Reprinted Chichester John Wiley & Sons Stuttgart BG Teufcner 1991 25cm XXI 403 S. P. 29854,86397KEITH E.GORLEN3 P 29854 ,chunk_3,
23586,2280.0,GORMAN,86389,Gorman Michael M Gorman Michael M Catastase Management Systems Understanding and Applying Database Technology Wellesley MA Q D Information Sciences Blue 1991 26cm XV 454 P 29809 9 kein SWK,86389MICHAEL M.GORMAN kein SWK ,chunk_3,
23587,2391.0,BERTSCHI (AD),84822,84822 Bercgchi Ad Versicherungswörterbuch Insurance Dictionary Dictionnaire d'assurance Dizionario assicurativo Karlsruhe 1974 12 x 17 cm,84822BERTSCHI (AD)-12xl7cm. ,chunk_0,
23588,2392.0,BERTSCHI (D),85036,85036 Bertschi D Marktstudie Personal Computer im Millionen Zürich Reaktion Georg Gatti Zürich Tages Anzeiger 1985 0cm 47 Sill,85036BERTSCHI (D)47 S.ill. ,chunk_0,
23589,2393.0,BERTSCHI (PF/WERB),86941,8694 l Bertschi P. F. W. E. R. B. Schmidt Klaus Hrsg. Corporate Identity in Europa Strategien Instrumente erfolgreiche Beispiele Zürich Verlag Neue Zürcher Zeitung 1994 26 cm 230 S,"86941BERTSCHI (PF/WERB)m, 230 S. ",chunk_0,
23590,2394.0,BERTSCHI (PR),82093,82»093 Bertechi PR Loewy Raymond Hässlichkeit verkauft sich schlecht Die Erlebnisse des erfolgreichsten Formgestalters unserer Zeit Aus dem Amerikanischen übersetzt von Hans Achmüller Weseloh Düsseldorf EGON Verlag 1992 22cm 310 S,"82093BERTSCHI (PR)m.310 S., ",chunk_0,
23591,2395.0,BERTSCHI (PR),82246,82246 Bertschi Jahrbuch Sponsoring 92 Hrsg. von Peter Strahlendorf 2. Ausgabe Düsseldorf EGON Verlag 1992 28 cm 166 S. fill,82246BERTSCHI (PR)6 S.fill. ,chunk_0,
23592,2396.0,BERTSCHI (PR),83469,83469 Bertschi PR Birkigt Klaus Stadier Marinus Mj Funck Hans Joachim Corporate Identity Grundlagen Punktionen Beispiel Fairbeispiele 5. völlig überarbeitete Auflage Landsterg Lech Verlag Moderne Industrie 1992 25 cm 623 S.,"83469BERTSCHI (PR)S.,Atrt). ",chunk_0,
23593,2397.0,BERTSCHI (PR),83561,83561 Bertschi PR Baltis Max Gut zum Druck Handbuch über das Vorbereiten und Herstellen von Drucksachen Aktualisierte und erweiterte Neuausgabe des Buches Die Drucksache hrsg. anlässlich des hundertjährigen Jubiläums des Tagesanzeigers,83561BERTSCHI (PR)zei- gers),chunk_0,
23594,2398.0,BERTSCHI (PR),83697,83697 Bertachi FR Huber Kurt Image Global Image Marken Image Produkt Image 2. Auflage Landsberg Lech Verlag Moderne Industrie 1990 25 cm 544 S. 111,"83697BERTSCHI (PR)4 S.,111. ",chunk_0,
23595,2399.0,BERTSCHI (PR),83822,83822 Bertschi PR Börsenlist Das Von Tarif A bis zum Zirka Auftrag Sonderdruck aus Schweizer Bank Zürich SHZ Fachverlag AG 1994 30 cm 21 S,83822BERTSCHI (PR)0cm.21 S. ,chunk_0,
23596,2400.0,BERTSCHI (PR),84965,84965 Bertschi PR Pfeffer Ursula 100 Waldwiesen im Kanton Zürich Standorte Plätzen Zahl Einrichtungen Mietpreise Kontaktpersonen und Adressen 2. bearbeitete Auflage Zürich Werd Verlag 1992 18 cm 47 S,84965BERTSCHI (PR)8cm.47 S. ,chunk_0,
23597,2361.0,LÜBSTORFF,,Lübstorff Friedrich Schaefer Wilhelm und P L Volkswirtschaft und Versicherung 1916,FRIEDRICHLÜBSTORFF    1916. ,chunk_5,
23598,2362.0,LÜBSTORFF,7476,Lubetorff Friedrich Lübstorff Friedrich Öffentlicher Betrieb und Privatbetrieb der Feuerversicherung Mit einer graphischen Darstellung Archiv für exakte Wirtschaftsforschung Thünen-Archiv Ehrenberg 3 Erg. Heft Jena: Fischer 1910 XII 471,"7476FRIEDRICHLÜBSTORFF(XII, 471 ",chunk_5,
23599,2363.0,LUCHSINGER,81362,81362 Luchsinger Schweiz die im Zahlenbild,81362LUCHSINGERhlenbild. ,chunk_5,
23600,2364.0,LUCHSINGER,81363,1386 Luchsinger SUIBBeL an Grafikes,"81363LUCHSINGERaphiques, ",chunk_5,
23601,2365.0,LUCHSINGER,93389,"Luchsinger, Fred. Luchsinger, Fred. Bemerkungen zur internationalen Politik Referat anlässlich der Generalversammlung der Zürcher Handelskammer vom 10. Juni 1976 Wirtschaftliche Publikationen der Zürcher Handelskammer 40 Zürich Verlag der Zürcher Handelskammer",93389FREDLUCHSINGERlag der Zü,chunk_5,
