id,field_id,titel_autor,rasignatur,volltext,unique_key,file,field
26197,2653.0,BIBL.,84995,84995 Dr. Kühn S. Handelsvertreter der in den Ländern der EWG und der EFT. Hrsg. von Hans Jakob Hailer Baden-Baden Nomos Verlagsgesellschaft 1976 23 cm» 404 S,84995BIBL.» 404  S. ,chunk_0,
26198,2654.0,BIBL.,85842,85842 Villord S Dictionnaire des néologismes officiels Textes législatifs et réglementaires 5e Édition Paris Journaux officiels 1988 50 cm 1238 p,"85842BIBL..1,238 p. ",chunk_0,
26199,2655.0,BIBL.,83038,Schwarzenbach Peter Vorlagensammlung für die Personalauswahl,83038BIBL.al- wähl. ,chunk_0,
26200,2656.0,BIBL.,83070,83070 Sommer Martin Wohnwert und Mietzins Eine quantitative Untersuchung zur Stadtgeographie von Zürich Diplomarbeit Univ Zürich Zürich Geographisches Institut 1978 30 cm 98 Sill Ringheftung,83070BIBL.gheftung. ,chunk_0,
26201,2657.0,BIBL.,83071,83071 Alltagfwgr Bloch Marcel E. Die Stellenbeschreibung,83071BIBL.hreibung. ,chunk_0,
26202,2658.0,BIBL.,83080,83080 Ruto K. Führungsführung und Förderung des Führungsnachwuches,83080BIBL. wuchaea. ,chunk_0,
26203,2659.0,BIBL.,"83087/1,3",83087 Wörterbuch der italienischen und deutschen Sprache Sansoni 2 Bände Supplementband 1984 Wiesbaden Brandstetter Verlag Firenze Editioni Sansoni 1967 1970 1984 31 cm,"83087/1,3BIBL.4.	-31cm. ",chunk_0,
26204,2660.0,BIBL.,83088,83088 Ga 419 Handbuch der schweizerischen Sozialstatistik,83088BIBL.statistik ,chunk_0,
26205,2621.0,MANAGEMENT-,83355,Managementsysteme Praktische Anwendungen Hrsg. Rolf Kichert Michael Moritz Berlin Springer Verlag 1992 25. em. XXII. 450 S. 30. 948,83355MANAGEMENT-  S 3o948 ,chunk_5,
26206,2622.0,MANAGEMENTGESPRÄCH,,Managementgespräch Managementgespräch internationales 1973 S. Unternehmung und Staat,MANAGEMENTGESPRÄCHd  Staat. ,chunk_5,
26207,2623.0,MANAGEMENT-KOMPETENZ,,Management Kompetenz s Thommen Jean Paul Hrsger» Management Kompetenz Die Gestaltungsansätze des NDU Executive IBA der Hochschule St. Gallen,MANAGEMENT-KOMPETENZt.Gallen. ,chunk_5,
26208,2624.0,MANAGEMENT-KONZEPT,,Management Konzept Management—Konzept St. Galler Band 2. Ilmpin Cuno Prange Jürgen Management der Unternehmensentwicklung,MANAGEMENT-KONZEPTung   ... ,chunk_5,
26209,2625.0,MANAGEMENT-METHODEN,97294,ManagementMethoden ManagementMethoden Mit Beiträgen von Peter Tlach ua 310 471 S. aus Industrielle Organisation 1968 H S Zürich Verlag Industrielle Organisation 1968 30 cm 40 S 11548 W,"97294MANAGEMENT-METHODEN, 11548	W ",chunk_5,
26210,2626.0,MANAGER,,Manager Manager Magazin Edition Hew business line 9 a Kralicek Peter Grundlagen der Finanzwirtschaft,MANAGERaft   ... ,chunk_5,
26211,2627.0,MANAGING,86748,Managing Managing Internet-Information-Services by Cricket Liu Jerry Peek LaoJ A nutshell handbook Sebastopol CA O'Reilly Associates Inc 1994 A 24 cm XXXVI 630 p 34209,86748MANAGING p. 34209 ,chunk_5,
26212,2628.0,MANDACH,,Mandach Theophil von Mandaci Theophil von Die Gemeinnützigkeit im Schweizerischen Steuerrecht Abhandlungen zum Schweizerischen Recht NF Heft 222 Bern Stampfli 1945 7115 S 19455433 Driur,THEOPHIL VONMANDACH(Dr.iur.) ,chunk_5,
26213,2629.0,MANDL,,Mandl Heinz 0 s Beitinger Gabriele MH1 Impulse zum Weiter lernen Einstieg ins selbstgesteuerte Lernen,HEINZMANDLnen   ... ,chunk_5,
26214,2630.0,MANDRY,,Mandry Ts Banahan Mike Rutter Andy UNIX Lernen verstehen anwenden Revidierte deutsche Ausgabe von A. Schreiner und T. M.,T.MANDRYund T.M'. ,chunk_5,
26215,2661.0,KAPITALANLAGEN,82659,82659 Kapitalanlagen Troostenburg de Bruyn Jan Jacob van Die volkswirtschaftliche Bedeutung der Hypothekarbedingungen,82659KAPITALANLAGENingungen. ,chunk_4,
26216,2662.0,KAPITALANLAGEN,82488,82488 Kapitalanlagen Langenscheidt Taschenwörterbuch der englischen und deutschen Sprache,82488KAPITALANLAGEN Sprache. ,chunk_4,
26217,2663.0,KAPITALANLAGEN,82514 - 82516,82514 82516 Kapitalanlagen Wehrli Adolf Wehrlis Zinstabellen,82514 - 82516KAPITALANLAGENellen ... ,chunk_4,
26218,2664.0,KAPITALANLAGEN (RUTZ),81950,81950 Kapitalanlagen Rutz Schönenberger W ZGB 1958,81950KAPITALANLAGEN (RUTZ)ZGB.	1958 ,chunk_4,
26219,2665.0,KAPITALANLAGEN (RUTZ),81951,8l 951 Kapitalanlagen Rutz Schönenberger W Or 1958,81951KAPITALANLAGEN (RUTZ) Or.	1958 ,chunk_4,
26220,2666.0,KAPITALANLAGEN (RUTZ),81955,8l955 Kapitalanlagen Rutz Hofmann Bruni Fachwörterbuch für das Baugewerbe,81955KAPITALANLAGEN (RUTZ)ewerbe... ,chunk_4,
26221,2667.0,KAPITALANLAGEN / DR. FEHR,82151-82153 / 82154,82 151 82 153 Kapitalanlagen 82154 Bfgamaattn 3 fe ReberHJ Der Werkvertrag im Baugewerbe 82 151 K 82 152 K — GubloJ S 8alg3 — K 82 154,82151-82153 / 82154KAPITALANLAGEN / DR. FEHR82  154   ,chunk_4,
26222,2668.0,KAPITALANLAGEN MOLL,81826,R R Kapitalanlagen D. L. ÖD „ T Moll Codice civile svizzero 1957,81826KAPITALANLAGEN MOLL ...	1957 ,chunk_4,
26223,2669.0,KAPITALANLAGEN MOLL,81827,o op7 Kapitalanlagen I T T Moll Codice delle obbligazioni 1958,81827KAPITALANLAGEN MOLL ...	1958 ,chunk_4,
26224,2670.0,KAPITALANLAGEN/LIEGENSCHAFTSVERWALTUNG,81703/81704,8l 705 Kapitalanlagen 8l 704 Liegenschaftenverw Hägi Adolf Die Bewertung von Liegenschaften 1957,81703/81704KAPITALANLAGEN/LIEGENSCHAFTSVERWALTUNG   (1957) ,chunk_4,
26225,2641.0,ZIELGRUPPE,,Zielgruppe I Zielgruppe Frauen Erfolgreiche Konzepte für effektives Marketing Hgin Dorothea Assig s Assig Dorothea Hgin Zielgruppe Frauen Erfolgreiche Konzepte für effektives Marketing,ZIELGRUPPEke- ting. ,chunk_9,
26226,2642.0,ZIELINSKI,94471/66,Zielinski Jan Zielinski Jan Ludwig von Tetmajer Przerwa 1850 1905 Gründer der Eidgenössischen Materialprüfungs- und Forschungsanstalt EMPA Pionier der Materialprüfung und Forschung Aus dem Polnischen übertragen von Marysia M,94471/66JANZIELINSKI Marysia M,chunk_9,
26227,2643.0,ZIELKE,,Zielke Wolfgang Zielke Wolfgang Schneller lesen intensiver lesen besser behalten 3. Auflage mvg Paperbacks 292 Landsberg am Lech mvg Verlag moderne Verlagsgesellschaft mbH 1988 A,WOLFGANGZIELKE          ,chunk_9,
26228,2644.0,ZIELKE,4631,Zieicke Wolfgang Zielke Wolfgang Gute Berichte flüssig schreiben gezielt informieren 4. Auflage München Verlag Moderne Industrie 1974 23 cm 20 S. Abb. Tab. 16450,"4631WOLFGANGZIELKE, 16450	^ ",chunk_9,
26229,2645.0,ZIETSCH,,Zietsch Dietmar a Hesse Detlef Controlling im Versicherungsunternehmen Autoren DH1 J Matthias Graf von der Schulenburg Norbert Wittmer D1Z1,DIETMARZIETSCH   D1Z1}- ,chunk_9,
26230,2646.0,ZIEZOLD,3733,Ziezold Bernhard Ziezold Bernhard Versicherungsmathematische Fehlerrechnung Versicherungsmathematische Forschung Heft 2 Leipzig R. Noske 1934 VI 47 S. 2229,"3733BERNHARDZIEZOLD * 2229	"" ",chunk_9,
26231,2648.0,ZIGERLIG,,Zigerlíg Rainer s Veidmann Heinz Grossmaiin Benno ZR 1 Wegweiser durch das St. Galler Steuerrecht,RAINERZIGERLIGeuerrecht ,chunk_9,
26232,2649.0,ZIHLMANN,12466,"Zihlmann, Peter. Das neue Mietrecht Einführung für den Praktiker Zürich Schultheiss Polygraphischer Verlag AG 1990 23 cm XXX 291 S","12466PETERZIHLMANNXXX,291 S ",chunk_9,
26233,2650.0,ZIHLMANN,,Zihlmann René Zihlmann René Das aktuelle Berufs awahl Truch mit Berufe Katalog 8889 Hrsger Schweizerischer Verband für Berufsberatung 2 Teile Teil 1 Das aktuelle Berufs awahlbuch 191 S Teil 2 Berufe Katalog 8889,RENEZIHLMANN 88/89-   ,chunk_9,
26234,2631.0,SCHNUPP,85450,Schnupp Peter Q O A5 O Schnupp Peter Nguyen Huu Chau Thuy Experten system Praktikum Springer Compass Berlin Heidelberg New York London Paris Tokyo Springer Verlag 1987 A,85450PETERSCHNUPP          ,chunk_7,
26235,2632.0,SCHNUSE,,Sehnuße C. H. B. Daily Francis Lee Theorie der Lebensrenten 189 240,C.H.SCHNUSE 18?9 240 ,chunk_7,
26236,2633.0,SCHNYDER,12418,Schnyder Anton K. Schnyder Anton K. Das neue IPR-Gesetz Eine Einführung in das Bundesgesetz vom 18. Dezember 1987 Über das Internationale Privatrecht Zürich Schulthess Polygraphischer Verlag 1988 XVI 161 S,12418ANTON K.SCHNYDER...   „	(E,chunk_7,
26237,2634.0,SCHNYDER,12371,"Schnyder Anton K. Schnyder Anton K. Staatsverträge im Internationalen Privat- und Zivilverfahrensrecht der Schweiz. Ein systematischer Führer mit Länderverzeichnis, Hinweisen auf die Praxis und Sachregister. Zürich: Schulthess Polygraphischer Verlag.",12371ANTON K.SCHNYDERphischer V,chunk_7,
26238,2635.0,SCHNYDER,1009,Schnyder Bernhard Schnyder Bernhard Murer Erwin. Die Vormundschaft Systematischer Teil und Kommentar zu den Art 60397f ZGB. Lfg. Systematischer Teil und Kommentar zu den Art 360 378 ZGB. 3. völlig neu bearbeitete Auflage des von,1009BERNHARDSCHNYDER des von .,chunk_7,
26239,2636.0,SCHNYDER,,Schnyder Mois Schweizer Pioniere der Wirtschaft und Technik Band 25,MOIASCHNYDERBand   25 ,chunk_7,
26240,2637.0,SCHNYDRIG (L),86245,86245 Sehnydrig L Verzeichnis 91 der Motorfahrzeughalter im Kanton St. Gallen Stand 1. Januar 1991 St. Gallen: Strassenverkehrs- und Schiffahrtsamt des Kantons St. Gallen 1991 30 cm 592 S,86245SCHNYDRIG (L)cm.592 S. ,chunk_7,
26241,2638.0,SCHÖB (CH/ITMM),88364,88364 VSchob ChITMM Böhm Rolf Wenger Sven Methoden und Techniken der Systementwicklung 3. durchgesehene Auflage Zürich vdf Hochschulverlag AG an der ETH Zürich 1999 24 cm XI 389 S,"88364V.SCHÖB (CH/ITMM).XI,389 S ",chunk_7,
26242,2639.0,SCHOBER,,Schober P. Schober Medizinisches Wörterbuch der deutschen und französischen Sprache 2 Teile in 1 Band 5A Stuttgart: F. Enke 1937 XI 381 S. 2452 Dr. Ober Med. Hat,P.SCHOBERMed.-Hat) ,chunk_7,
26243,2640.0,SCHOCH,,Schooch J. Ulrich. Gesetz betreffend die Brandversicherung für die Gebäude im Kanton Zürich vom 25. Okt. 1885 abgeändert am 4. März 1894 und 24. März 1901. Selbstverlagsverf. 1901. 20 S.,J.    ULRSCHOCH   (20 S.),chunk_7,
26244,2551.0,COOLIDGE,3438,Coolidge J. Coolidge J. L. Einführung in die Wahrscheinlichkeitsrechnung Deutsche Ausgabe von Friedrich M. Urban Sammlung mathematisch-physikalischer Lehrbücher Sd. 24 Leipzig: B. G. Teubner 1927. IX. 212 S. p. 1421,3438J. LCOOLIDGEp.) 1421  ,chunk_1,
26245,2552.0,COOMBS,85016,Coombs H J Coombs M J Developments in expert systems From a special issue of the International journal of man-machine studies ed by M. J. C. 1 Computers and People Series London: Academic Press Harcourt Brace Jovanovich Publishers 19,"85016M.J.COOMBSshers, (19",chunk_1,
26246,2553.0,COOMBS,84862,Goombe M. J. Coombs M. J. i Alty J. L. Computing skills and the user interface Ed. by M. J. C. and J. L. A. Computers and people series 3 London Academic Press Inc. Harcourt Brace Jovanovich Publishers 1981 A,84862M.J.COOMBS          ,chunk_1,
26247,2554.0,COOP,,Coop Coop Lebensversicherungsgenossenschaft 1917 1967 s Erinnerungen einer Fünfzigjährigen,COOPjährigen. ,chunk_1,
26248,2555.0,COOPER,2999 A,Cooper G. Ashley Cooper G. Ashley Insured va noninsured plans An address given at the Swiss Life European Employee Benefit Conference May 1970 Zurich 1970 8 16 p,"2999 AG. ASHLEYCOOPER8 , 16 p. ",chunk_1,
26249,2556.0,COPIN,1427,Copin Louig. Copin Louie. Traité théorique et pratique de l'impôt sur le revenu. Paris : R. Pichon 1926. 304 S. 1415 Avocat §,1427LOUISCOPIN      §*< ,chunk_1,
26250,2557.0,COPLIEN,83831,Goplien James O. Goplien James O. Advanced C programming styles and idioms Reprinted with corrections Reading MA Addison-Wesley Publishing Company 1994 A 24craXXIV520 p,"83831JAMES O.COPLIENIV,520 p. ",chunk_1,
26251,2558.0,COPRESS,,"Brück, E. Brück, E. Reichsgesetz über den Versicherungsvertrag nebst dem zugehörigen Einführungsgesetz Vom 30 Mai 1908 7. Auflage Guttentagsche Sammlung Deutscher Reichsgesetze Nr 83 Berlin W de Gruyter & Co 1932 VIII 563 56 S",COPRESSadres ... ,chunk_1,
26252,2559.0,CORAY,,Coray Richard a Schweizer Pioniere der Wirtschaft und Technik Band 41,RICHARDCORAYnd 41 ... ,chunk_1,
26253,2560.0,"CORBUSIER, LE",,"Brück, E. Brück, E. Reichsgesetz über den Versicherungsvertrag nebst dem zugehörigen Einführungsgesetz Vom 30. Mai 1908 7. Auflage Guttentagsche Sammlung Deutscher Reichsgesetze Nr 83 Berlin W de Gruyter & Co 1932 (VIII 563 56 S)","CORBUSIER, LECorbusier ",chunk_1,
26254,2611.0,PISTEK (MS/IBTK),87778,87778 Pistek MSIBTK Gillhuber Andreas ATM Internetworking Campusnetze Migrationskonzepte Ausfallsicherheit Fossil Edition Netze Reihe Network Computing Köln Fossil Verlag GmbH 1997 22 cm 171 S,87778PISTEK (MS/IBTK)2cm.171 S.,chunk_6,
26255,2612.0,PISTEK (P),85369,85369 Pistek P. Gulbins Jürgen UNIX. Eine Einführung in Begriffe und Kommandos von UNIX Version 7 System III und System V 2 völlig überarbeitete und erweiterte Auflage Berlin Springer Verlag 1985 25 cm IX 555 S,"85369PISTEK (P)IX,555 S. ",chunk_6,
26256,2613.0,PISTEK (P),85441,85441 Pistek P. Herold E. Elnut Unger Y. Ferner D. A. Buch München Tewi Verlag GmbH 1986 22 cm IX 555 S,85441PISTEK (P)[555]  S. ,chunk_6,
26257,2614.0,PISTEK (P),85442,85442 Pisteb P. Schildt Herbert Professionelles G. Hamburg: McGraw-Hill Book Company GmbH 1986 24 cm 340 S,85442PISTEK (P). 340  S. ,chunk_6,
26258,2615.0,PISTORIUS,,Pletorica Th Piatorius Th Gesetz betreffend die Einkommensteuer für das Königreich Württemberg vom 8. August 190 nebst Ausführungsbestimmungen und einem Anhang betreffend die Kapitalsteuer Herausgegeben von TP Ravensburg Maier,THPISTORIUS:0.Maier [,chunk_6,
26259,2616.0,PITMAN,,Pitman Pitman. Pe Dictionary of Life Insurance. Richmond G. W. and F. H. Sherriff. Pitman 8. Dictionary of Life Insurance 1930. 1752.,PITMAN1930 1752 ,chunk_6,
26260,2617.0,PITTÀNO,,"Pittano Giuseppe's Sinonimi e Contrari. Dizionario fraseologico delle parole equivalenti, analoghe e contrarie di GP1",GIUSEPPEPITTÀNOdi  G'P1. ,chunk_6,
26261,2618.0,PITTARD,,Fittard Edmond Pittard Edmond. Das rechtliche Régime der internationalen Luftfahrt in der Schweiz Veröffentlichungen der Schweizerischen Gesellschaft für internationales Recht Nr. 28 Zuritsch Grell Füssli 1952 J 4155 Prof. Dr. Genève,EDMONDPITTARD        \ ,chunk_6,
26262,2619.0,PITTET,97684,Pittet Meinrad Pittet Meinrad Les caisses de pensions de droit public dans la prévoyance professionnelle suisse Quel avenir Études et documents Genève Fédération des Syndicats Patronaux de Genève 1997 30 cm XI 264 p G Hrsger,97684MEINRADPITTET G Hrsger ,chunk_6,
26263,2620.0,PITTET,31094,Fittet Meinrad Pittett Meinrad. Lestimation der Papierswerte auf die Tilan der Gesellschaften für Lebensversicherung auf der Grundlage von Thèse École des Hautes Études Commerciales Universität de Lausanne Genève Imprimerie Pot 1980 21 ctnl 66 p 18745,31094MEINRADPITTET6 p 18745 ,chunk_6,
26264,2641.0,FORMEN,,Formen Formen und Normen Tor und Nachteile einzelner Rechtsformen der Unternehmung s Salzmann Wolfgang Formen und Normen,FORMENmen   ... ,chunk_2,
26265,2642.0,FORMES,,Formen Formeé de placements de la prévoyance professionnelle publique Colloque de la SSSA du 17 novembre 1989 s Anlageformen der beruflichen Vorsorge der öffentlichen Hand Tagung der SGVV vom 17. November 1989,FORMESer 1989 . ,chunk_2,
26266,2643.0,FORMULAIRE,1402,Formula ire Formulaire grand pratique des actes et documents privés contenant des modèles pour la généralité des actes sous seings privés lettres missives par un groupe de jurisconsultes et d'économistes Paris M. Chelinck 1930 37554 p 17,1402FORMULAIRE554 p.) 17,chunk_2,
26267,2644.0,FORMULARE,31089,Formulae and tables for actuarial examinations Institute of Actuaries and The Faculty of Actuaries Oxford Alden Press 1980 24cm 9125 p,"31089FORMULARE9,125  p. ",chunk_2,
26268,2645.0,FORNALLAZ,72258,Fornallas Paul Pornallaz Paul Die Wahrscheinlichkeitsrechnung im Dienste der Arbeitsanalyse SA Industrielle Organisation 1940 Zürich Rüegg 1940 56 S.,72258PAULFORNALLAZ i      ™ ,chunk_2,
26269,2646.0,FORNEY,,Forney Albert S. Möglichkeiten der Durchsetzung der Steuerharmonisierung in der Schweiz,"ALBERTFORNEY Schweiz, ",chunk_2,
26270,2647.0,FORNEY,,Porry John I. Differences in tax treatment of foreign investors Committee on taxes of the Section of Business Law of the International Bar Association General Reporter and Editor J11,JOHN I.FORNEY J1!*]?1. ,chunk_2,
26271,2648.0,FORRER (AD),83869,83869 R. Forrer AD Girard el Theo Heilen mit Farben Gesundheit und Wohlbefinden durch Farbe und Licht Aarau AT Verlag 1994 25 cm 128 S,83869R.FORRER (AD)25cm.128 S,chunk_2,
26272,2649.0,FORRER (AD),"81801/1,2",81801 12 Forrer Ad Versicherungswörterbuch Insurance Dictionary Dictionnaire d'assurance Dizionario assicurativo Karlsruhe 1974 12x17cm 2 Expl,"81801/1,2FORRER (AD). 2 Expl. ",chunk_2,
26273,2650.0,FORRER (AD),82879,82879 Forrer A. Führer durch die obligatorische Unfallversicherung 26. Auflage. Luzern 1979,82879FORRER (AD)rn] 1979. ,chunk_2,
26274,2541.0,TOLUNAY,12641,"Tolunay A. Oezgerhan. La notion de l acidente du travail dans l assurance accidents obligatoire en droit suisse allemand et français. Thèse Neuchâtel : Marin Imprimerie A 34 SA 1977. 20 cm. IV, 360 p.","12641A.OEZGERHANTOLUNAYm.IV,360 p",chunk_8,
26275,2542.0,TOMCZAK,83879,Tomczak Torsten Tomczak Torsten Beiz Christian Hürger Kundennäherealisieren Ideen Konzepte Methoden Erfahrungen Günther Haedrich zum 60. Geburtstag Fachbuch Marketing St. Gallen Verlag THEXIS 1994 31 cm 424 S 32813,83879TORSTENTOMCZAK424 S32813,chunk_8,
26276,2543.0,TOMCZAK,83971,Tomczak Torsten Toniczak Torsten Reinecke Sven Marktforschung Fachbuch für Marketing St. Gallen Verlag THEXIS 1994 30 cm 273 S 3313o,83971TORSTENTOMCZAK273 S3313o,chunk_8,
26277,2544.0,TOMINAGA,87379,Tominaga Minoru Tominaga Minoru Die kundenfeindliche Gesellschaft Erfolg Strategien für Dienstleister 6. Auflage Düsseldorf EGON Verlag GmbH 1997 22 cm 231 S,87379MINORUTOMINAGA231 S36512,chunk_8,
26278,2545.0,TONDEUR,4431,Tondeur Edmond 34 Tondeur Edmond Keller Jakob Keine Angst vor Mitbestimmung 10 Denkschritte für Unternehmer Führungskräfte Personalleiter Schrittmacher ET JK Die Organisator Bücher Mr 51 Glattbrugg Zürich Verlag Organisator 1971,"4431EDMONDTONDEURtor,(1971)",chunk_8,
26279,2546.0,TONDEUR,97377/74,Toadeur Edmond Tondeur Edmond Riedl Hugo Öffentlichkeitsarbeit Das Unternehmen in der Auseinandersetzung mit Gesellschaft und Öffentlichkeit Die Orientierung Nr. 74 Bern Schweizerische Volksbank 1980 30 cm 25 S Abb,97377/74EDMONDTONDEUR.25 S.Abb.,chunk_8,
26280,2547.0,TONDO,86050,Tondo Clovis LTondo Clovis L Gimpel Scott E The C answer book 2nd edition Solutions to the exercises in The C programming language 2nd edition by Brian WKemighan and Dennis M Ritchie Prentice Hall software series Englewood Cliffs HJ P,"86050CLOVIS L.TONDOfs,H.J.: P",chunk_8,
26281,2548.0,TONGUE,86050,Tongue Archers Colloque international sur la prévention et le traitement des tiqueomanies Lausanne 1970,86050ARCHERTONGUEanne 1970.,chunk_8,
26282,2549.0,TONGUE,,Tongue E. V. as Colloque international sur la prévention et le traitement des toxicomanies Lausanne 1970,EVATONGUEanne 1970.,chunk_8,
26283,2550.0,TONHALLE,93140,Tonhalle Tonhalle Gesellschaft Zürich D I ver sea Zürich Gotthardstraße 1 1979,"93140TONHALLE,   1979 -",chunk_8,
26284,2551.0,GROUPEMENT,97393,Groupement Groupement International pour l Étude des problèmes de l Épargne Colloque Rome le 28 29 et 30 novembre 1974 Rome 1974 31 cm Xerograph,97393GROUPEMENTograph.]. ,chunk_3,
26285,2552.0,GROUPEMENT,93346,Groupement Groupement international pour l étude des problèmes de l épargne L avenir de l épargne dans la société de consommation Colloque des 16 et 18 octobre 1969 Munich Bruxelles C. Rapsal 1970 24 cm 278 p,93346GROUPEMENTm. 278 p. ,chunk_3,
26286,2553.0,GROUX,85027,Groux Jean Groux Jean Manin Philippe Die Europäischen Gemeinschaften in der Völkerrechtsordnung Europäische Perspektiven Brüssel Kommission der Europäischen Gemeinschaften 1984 A,85027JEANGROUX          ,chunk_3,
26287,2554.0,GROVE,3630,Grove Endell E Grove Endell E Brief numerische Methoden Einleitung in elementare numerische Methoden mit Schwerpunkt auf iterative Lösungen Englewood Cliffs NJ Prentice Hall Inc. 1966 IX 117 S. 87 75,3630ENDELL E.GROVE p.) 8775 ,chunk_3,
26288,2555.0,GRUBE,2841/C,Grülie Harry Grubej Harry Privatversicherung und Geldentwertung Betriebswirtschaftliche Forschungen Serie II VDI Berlin Spaeth Linde 1923 143 S 1316 W Dr,2841/CHARRYGRUBE    (Dr.) ,chunk_3,
26289,2556.0,GRUBENMANN,,Grubenmann Hans Ulrich s Schweizer Pioniere der Wirtschaft und Technik Band 41,HANS ULRICHGRUBENMANN 41   •*. ,chunk_3,
26290,2557.0,GRUBER,84311,Gruber Hans Gruber Hans Handkommentar zum bernischen Gesetz Über die direkten Staats- und Gemeindesteuern vom 29. Oktober 1944 Mit Abänderungen und Ergänzungen bis 11. Februar 1974 Bern Frankfurt Herbert Lang 1975 21 cm 351 S 14371,84311HANSGRUBER1  S 14371,chunk_3,
26291,2558.0,GRUBER,,"Gruber, Sepp. Office Automation Schlüssel zur Zukunft St. Gallen: IKU-Verlag, Meilen 1986. A 24 cm. 555 S. 24682",SEPPGRUBERS 24682	^ ,chunk_3,
26292,2559.0,GRUBMANN,,Grutmann Friedrich a Wähle Karl G F. Das Versicherungsvertragsgesetz,FRIEDRICHGRUBMANNagsgesetz ,chunk_3,
26293,2560.0,GRUDBUCHVERWALTER,,Grundbuchverwalter Grundbuchverwalter Tagung schweizerische 1977 in Zürich s Deschenaux Henri Die Verantwortung für die Führung des Grundbuchregisters Huber Hans Anmeldung und Tagebuch im schweizerischen Grundbuchrecht Schweizerisches Grundbuchverzeichnis,GRUDBUCHVERWALTERGrundbuchv,chunk_3,
26294,2661.0,BIBL.,83135,83135 Ga 509 Working manual for the Integration of qualified retirement plans with social security Edition 1974,83135BIBL.on 1974.) ,chunk_0,
26295,2662.0,BIBL.,82740,Wallingor Haymoz Jean Pierre Taur de cotisation et systèmes financiers dans l assurance vieillesse,82740BIBL.eillesse. ,chunk_0,
26296,2663.0,BIBL.,82828,8282B G G 41 Dorow Sybille Altarator a Sicherung international,"82828BIBL.ational , ",chunk_0,
26297,2664.0,BIBL.,82842,82842 Weidmann Heinz Wegweiser durch das gallische Steuerrecht,"82842BIBL.r recht , ",chunk_0,
26298,2665.0,BIBL.,82935,82935 IC 404 Maatt Friedrich Hans Peter Der Rang der Grundstückarechte 1977,82935BIBL.hte 1977. ,chunk_0,
26299,2666.0,BIBL.,82304,82304 M Thaltlear Income Tax Act 1952,"82304BIBL.,   1952, ",chunk_0,
26300,2667.0,BIBL.,82336,82336 M ThoJikor Convention between the Governments of the United Kingdom of Great Britain and Northern Ireland to extend and coordinate Social Security Schemes,82336BIBL.chemes... ,chunk_0,
26301,2668.0,BIBL.,82374,82374 Ammotor Kongress XII internationaler der Versicherungs mathematiker Luzern 1940 Band 14,82374BIBL.Band 1-4. ,chunk_0,
26302,2669.0,BIBL.,85422,85422 Nickelwaninger Hartmut Versicherungsmarketing auf der Grundlage des Marketing von Informationsprodukten Veröffentlichungen des Seminars für Versicherungslehre der Universität Frankfurt am Main Band 2 Karlsruhe VVWJ Verlag V,85422BIBL. (Verlag V,chunk_0,
26303,2670.0,BIBL.,85551,85551 Betriebe Spionage Begehungsformen Schutzmaßnahmen Rechtsfragen Hörer Karl Hans Liebl Ingelheim Peter Hohl Verlag 1987 21 cm 544 S,85551BIBL.m. 544 S. ,chunk_0,
26304,2631.0,MANEKELLER,4581,Manekeller Frank W. Manekeller Frank W. Das große Handbuch der Musterbriefe für Privat- und Geschäftskorrespondenz mit Kommentaren und Stilvarianten unter Mitarbeit von B. Hersfeld 4. Auflage Landsberg am Lech: Verlag Moderne Gesellschaft,4581FRANZ W.MANEKELLERgesellacha,chunk_5,
26305,2632.0,MANEKELLER,82313,Manekeller Prank W Manekeller Frank W Das große Handbuch der Musterbriefe für Privat im Geschäfts korrespondenz Mit Kommentaren und Stilvarianten unter Mitarbeit von B. Hersfeld München MVG Moderne Verlags GmbH 1979 23 cm 551 S 17810,82313FRANZ W.MANEKELLER1 S 17810 ,chunk_5,
26306,2633.0,MANEKELLER,4111,Manekeller Wolfgang 4f J Manekeller Wolfgang Möhl Werner Mitarbeiter Bewertung Maßstäbe und Methoden der Persönlichkeits- und Fähigkeitsbeurteilung Die Erfolg Bücher Band 12 2. Auflage Bad Wörishofen Hans Holzmann Verlag 1970,"4111WOLFGANGMANEKELLERerlag,1970",chunk_5,
26307,2634.0,MANEKELLER,4592,Manekeller Wolfgang Manekeller Wolfgang Briefe schreibt man heute so Brief bild rationeller Stil Textprogrammierung Die Erfolg Bücher Band 14 Bad Wörishofen iHans Holzmann Verlag 1970 11249,4592WOLFGANGMANEKELLER0.) 11249 ,chunk_5,
26308,2635.0,MANES,,Manes Alfred. Manes Alfred. Versicherungs-Lexikon Ein Nachschlagewerk für alle Wissensgebiete der gesamten Individual- und Sozialversicherung 3. Auflage. Berlin: Mittler Sobn 1930. XX-1934 S.,ALFREDMANES¿S 1898	™ ,chunk_5,
26309,2636.0,MANES,72054,Manes Alfred O 5 ¥• Manes Alfred Versicherungswesen 2 Bände 4A 7118 Taus Leipzig: BGT Teubner 1924. 425 X,72054ALFREDMANES       X? ,chunk_5,
26310,2637.0,MANES,2305/1-3,Manes Alfred • y 3 Manes Alfred Versicherungswesen System der Versicherungswirtschaft Bd I Allgemeine Versicherungslehre II Güterversicherung III Personenversicherung 5A Leipzig BGT Oubner 1903 2 S « 1,2305/1-3ALFREDMANES2. i S « 1,chunk_5,
26311,2638.0,MANES,6182,Manes Alfred Manes Alfred Die deutschen Privatversicherungsgesetze Berlin: Sieben Stäbe 1929 • XVI 174 S. 1655 F. Dr. Professor,6182ALFREDMANES       /? ,chunk_5,
26312,2639.0,MANES,6138,Manes Alfred Manes Alfred Sozialversicherung Arbeiterversicherung und Angestelltenversicherung 6A Berlin: W. de Gruyter 1926 128 S 1321 Pro f Dr,6138ALFREDMANESo f. Dr.) ,chunk_5,
26313,2640.0,MANES,72053/1.2,Manes Alfred Manee »Alfred Versicherungswesen Bd I Allgemeine Versicherungslehre II Besondere Versicherungslehre 3A 5 u 6 Taus Leipzig B G Teutner 1922 XIV 357 S 1032 W,72053/1.2ALFREDMANES  W       ,chunk_5,
26314,2641.0,SCHOCH,5594,Schoch Rudolf. Hundert Jahre Tonhalle Zürich Festschrift zum hundertjährigen Bestehen der Tonhalle Gesellschaft Zürich. Illustrationen Zürich: Tonhalle Gesellschaft Atlantis Verlag 1960. 291 S.,5594RUDOLFSCHOCH0.(291 S.),chunk_7,
26315,2642.0,SCHOCH,,Schock Claudia s Partnerschaft Neue in der Ehe Hrsg von CS1,CLAUDIASCHOCH von C'S1 ,chunk_7,
26316,2643.0,SCHOCH (KE),83570,85570 Schoch KE Aeppli Heinz SGBOR Schweizerisches Zivilgesetzbuch und Obligationenrecht Vollständige Ausgabe des Gesetzes 2730. Auflage Zürich Grell Füssli 1992 16 cm XXXVI 551 S XLVI 605 S,"83570SCHOCH (KE)VI,605 S. ",chunk_7,
