id,field_id,titel_autor,rasignatur,volltext,unique_key,file,field
20857,2090.0,LIENHART,1961/15,Lienhart E. Lienhart E. Der Handelsreisende im schweizerischen Recht Ausweiskarten und Anleitungen Verhältnis der Handelsreisenden Der Rechtsberater für Handelsreisende und Geschäftsinhaber Rechtlehre für jedermann Heft 15 Zürich,1961/15E.LIENHART. Zürich [,chunk_5,
20858,2011.0,CAVELTI (VW),83990,"Caveltt VW Robert Paul. Le nouveau petit Robert Dictionnaire alphabetique et analogique. Paris: Dictionnaires Le Robert 1994. 24 cm. XXXV, 2467 p.","83990CAVELTI (VW)XV,2467 p.",chunk_1,
20859,2012.0,CAVIEZEL,12109,Caviezel Paul RF 4 O Caviezel Paul Sortimentspolitik in der Schaden- und Unfallversicherung Diss Hochschule St. Gallen Chur Paul Bärtsch Dr. 1972 23 cm XXXI 267 S Tab 12619,12109PAULCAVIEZELb.. 12619 ,chunk_1,
20860,2013.0,CAVIEZEL,97378,Caviezel Werner Caviezel Werner Die Eigentumsgarantie im Lichte der neueren bundesgerichtlichen Praxis unter besonderer Berücksichtigung von Maßnahmen des Landschaftsschutzes Bern Schweizerische Stiftung für Landschaftsschutz und Landschaft,97378WERNERCAVIEZELLandschaft,chunk_1,
20861,2014.0,CAVIEZEL,93388,Caviezel Werner tf B 3 Caviezel Werner La garantie de la propriété considérée à la lumière de la récente jurisprudence du Tribunal fédéral en la matière avec application particulière aux mesures prises en faveur de la protection du paysage Trad,93388WERNERCAVIEZELsage. Trad,chunk_1,
20862,2015.0,CAVIGELLI,97665,Cavigelli Martin Cavigelli Martin Organisationales Lernen in der Rentenanstalt Swiss Life Die Entstehung der Mittelfristplanung im Geschäftsbereich Unternehmen Schweiz unter dem Aspekt des organisationalen Lernens Lizenztiatsarbeit Univ Zürich,97665MARTINCAVIGELLIUniv.Züric,chunk_1,
20863,2016.0,CAVIGELLI (CG/PEQM),87834,87834 Cavigeili CGPEQM Guide Coaches to the Memory Jogger II The easy-to-use complete reference for working with improvement and planning tools in teams Methuen MA GOAL PC 1995 28 cm XVIII 254 p,"87834CAVIGELLI (CG/PEQM)III,254 p,",chunk_1,
20864,2017.0,CAVIGELLI (CH/PEOM),87352,87352 Cavigelli CHPEQM Burghardt Manfred Einführung in Projektmanagement Definition Planung Kontrolle Abschluss Hrsg. Siemens Aktiengesellschaft Berlin München Publicis MCD Verlag 1995 25 cm 283 S,87352CAVIGELLI (CH/PEOM)cm.283 S. ,chunk_1,
20865,2018.0,CAVIGELLI (CH/PEOM),87681,87681 Cavigelli CHPEQM Q Agenda 1998 Das Jahrbuch zur Qualität 3 Jahrgang Gossau Mediares AG 1998 24 cm 173 S,"87681CAVIGELLI (CH/PEOM)cm.173 S, ",chunk_1,
20866,2019.0,CAVIGELLI (CH/PEOM),87758,87758 Cavigelli CHPEQM Probst Gilbert Raub Steffen Romhardt Kai wissen managen Wie Unternehmen ihre wertvollste Ressource optimal nutzen 2. erweiterte Auflage Frankfurt/Main Frankfurter Allgemeine Zeitung GmbH Wiesbaden Betriebsw.,87758CAVIGELLI (CH/PEOM)Betriebswi,chunk_1,
20867,2020.0,CAVIGELLI (CH/PEQM),87766,87766 Cavigelli CHPEQMDuWuri Stefan A Schäfer Thomas Hrsger Qualitätsmanagement Report der Banken Wiesbaden Betriebswirtschaftlicher Verlag Dr Th Gabler GmbH 1998 21 cm XXIII 419 S,"87766CAVIGELLI (CH/PEQM)III,419 S.",chunk_1,
20868,2001.0,GIANELLI (AD),84734,84734 Gianelli Ad Lattmann J. Scharpff D. F. Versicherung in Schweizer Franken als Kapitalanlage niedergelassst 1979,84734GIANELLI (AD)t (1979). ,chunk_3,
20869,2002.0,GIANINI,,Gianini Franz s Carlen Franz Div Bücher für CHU4,FRANZGIANINIfür CH/U4 ,chunk_3,
20870,2003.0,GIANINI,86554,Gianini Graziella Gianini Graziella Dizionario tecnico per l edilizia e il genio civile Italienod e s c o Fachwörterbuch für das Bau- und Ingenieurwesen Deutsch- Italienisch Lugano Fontana Edizioni SA 1990 21 cm 532 p 335 5737595,"86554GRAZIELLAGIANINI57,37595, ",chunk_3,
20871,2004.0,GIANINI (U3) HG,83279,83279 Gianini M. Ug H. Schwarzenbach Hanhart Hans Rudolf Berufliche Vorsorge in Text und Tafeln Textausgabe mit Verweisen Zürich Schulthess Polygraphischer Verlag AG 1995 IACRN XVI 246 S,"83279M.GIANINI (U3) HGVI,246 S. ",chunk_3,
20872,2005.0,GICK-SCHLÄPFER,12223,"Gicle Schlüpfer Gick, Sehläpf er Carlo. Die Mitwirkungspflichten von Drittpersonen im schweizerischen Pfändungs- und Arrestverfahren unter besonderer Berücksichtigung der Stellung der Banken. Dieses Universitätsdokument Zürich Zürcher Studien zum Verfahren",12223GICK-SCHLÄPFERer- fahr e,chunk_3,
20873,2006.0,GIDE,,Gide Charles S. Fisher Irving Moral bei der Geldausgabe und beim Geldrück zuge 1925,CHARLESGIDE...	1925. ,chunk_3,
20874,2007.0,GIDS 1979,2991,Gids de kleine voor de Nederlandse sociale verzekering 1965 Uitgave van de Vereeniging van Raden van Arbeid Amsterdam 1965,2991GIDS 1979dam 1965- ,chunk_3,
20875,2008.0,GIEBEL,,Giebel Martin L. s Curth Michael A. G. M. L. Management der Softwarewartung,MARTIN L.GIEBELrtung ... ,chunk_3,
20876,2009.0,GIEDION,,Giedion S S Boesiger W Richard Neutra,S.GIEDIONrd Neutra ,chunk_3,
20877,2010.0,GIENOW,,Gienow HS Zweigniederlassungen und Tochtergesellschaften im Gemeinsamen Markt,H.GIENOWen Markt. ,chunk_3,
20878,2141.0,BERCHTOLD (IN),83661,83661 Foamaguin Williamsou Uicfeey Softwarekonfigurationsmanagement und Versionskontrolle 2. Auflage Arlington MA Cutter Information Corp 1993 28 cm 146 S.,83661J.BERCHTOLD (IN)cm.146 p. ,chunk_0,
20879,2142.0,BERCHTOLD (IN),"85905/1,2",8590512 Dupultalbot Steve. Managing Projects with Wake C Programming Utility A Nutshell Handbook. O'Reilly Associates Inc. 1988. 22 cm. 77 S.,"85905/1,2BERCHTOLD (IN)cm. 77 p. ",chunk_0,
20880,2143.0,BERDEZ,,Bardez Charles Berdez Charles Lee basés juridiques et économiques de l'assurance privée Lausanne FR Rouge 1895 16360 S 310 ™ Driur S,CHARLESBERDEZ        S*,chunk_0,
20881,2144.0,BERDOZ,,Berdoz Philippe Manuel suisse de révision 1992 élaboré par Pius Bachmann Eraile F Born ea Adaptation française par PB 1,PHILIPPEBERDOZP'B1   ...,chunk_0,
20882,2145.0,BERECHNUNG,,Berechnung der des Risikos der Invaliditätsrenten Koeppler Hans Die Berechnung des Risikos 1917,BERECHNUNG..  (1917Ì,chunk_0,
20883,2146.0,BERESIN,3834/1.2,Beresin I. S. 23 ¿ Beresin I. S. Shidkow N. Numerische Methoden 2 Bände Hochschulbücher für Mathematik Band 70 und 71 Berliniert Deutscher Verlag der Wissenschaften 1970 1971 24 cm Bd. 1384 S. 14 Abb. Bd. 11284 S. 11 Abb. 12413 12453,"3834/1.2I.S.BERESIN413, 12453",chunk_0,
20884,2147.0,BERETNING,,Beretning Beretning fra Forsikringsrådet Afgiven til Ministeren for Sundhedsvaesen i henhold til Lov om Livsforsikringsvirksomhed af 30. Juni 1922 53 Året 1905 1936 f7 E8 fehlen 1918 1924 a1926 1924 1926 1936 • J,"BERETNING6,1936^•	J",chunk_0,
20885,2148.0,BERETNING,97045,Beratung 97045 Beretung über die Erhebung der Steuerpflichtigkeit in den Jahren 1934. Amt für Statistik vom 31. Dezember 1945 herausgegebene Reichskopfschrift Staatsanstalten für Lebensversicherung Kopenhagen Schadz 1947 69 S,97045BERETNING7.	(69 S.),chunk_0,
20886,2149.0,BEREUTER,,Bereuter Rudolf Favre Enry et RB Étude de la répartition des tensions d'une pièce encastrée en fonction de l'angle d'incidence 1944,RUDOLFBEREUTERce.	(1944),chunk_0,
20887,2150.0,BERG,87969,Berg Daniel Jürgenberg Daniel J. Fritzinger J. Steven Advanced Techniques for Java Developers New York John Wiley & Sons Inc. 1997 24 cm XVII 426 p. 1 CD-ROM,"87969DANIEL J.BERG,1 CD-ROM.",chunk_0,
20888,2101.0,WITTMANN,98024,Wittmann Walter Wittmann Walter Die neuen Ausbeuter 2. Auflage Stuttgart Seewald Verlag 1980 21 cm 203 S 18626,98024WALTERWITTMANN203 S18626,chunk_9,
20889,2102.0,WITTMANN,5528,Wittmann Walter Wittmann Walter Wohin treibt die Schweiz Die Schweiz in den achtziger Jahren verpasste Chancen oder Bewältigung der Zukunft Ein politischewirtschaftlichegesellschaftliche eher Schweizer Spiegel Bern München,"5528WALTERWITTMANNünchen),  ",chunk_9,
20890,2103.0,WITTMANN,93377/71,Vittmann Walter Vittmann Walter Die Bundesfinanzen Die Orientierungshilfe von der Schweizerischen Volkstank Nr. 71 1979 Bern Schweizerische Volksbank 1979 30 cm 28 S Graph,93377/71WALTERWITTMANN.^^	Graph.,chunk_9,
20891,2104.0,WITTMANN,5702,Wittmann Walter. Wohin geht die Schweiz Strategien des Überlebens. München J. Ehreuwirth 1973 22 cm 310 S 13571,5702WALTERWITTMANN0  S.13571,chunk_9,
20892,2105.0,WITTMANN,5688,"Wittmann, Walter. Der unbewältigte Wohlstand. Die Zukunft von Wirtschaft Staat und Gesellschaft. München: Franz Ehrenwirth Verlag 1972. 23 cm. 341 S. 12794",5688WALTERWITTMANN   S.12794,chunk_9,
20893,2106.0,WITTMER,,Wittmer Jacquess Riedweg AJ L application extraterritoriale de la législation sur les pratiques commerciales restrictives,JACQUESWITTMER-tives ...,chunk_9,
20894,2107.0,WITTMER,,Vittmer Norbert Hesse Detlef Controlling im Versicherungsunternehmen Autoren DHf J Matthias Graf von der Schulenburg NVf,NORBERTWITTMER'Vf    ...,chunk_9,
20895,2108.0,WITTROCK,86656,Vittrock Garsten. Vittrock Garsten. Messung und Analyse der Performance von Wertpapierportfolios. Eine theoretische und empirische Untersuchung. Portfoliomanagement Band 2. Bad Soden-Taunus: Unlenbruch Verlag 1995. 21 cm. A XIV,"86656CARSTENWITTROCK1cm.A	XIV,",chunk_9,
20896,2109.0,WITTSTEIN,,Tittstein Theodor Theodor. Mathematische Statistik und deren Anwendung auf Nationalökonomie und Versicherungwissenschaft. Hannover: Hahn 1865. Sys. 58 B Prof. Dr.,THEODORWITTSTEIN(Prof.Dr.),chunk_9,
20897,2110.0,WITTSTEIN,3766,Wittstein Theodor Wittstein Theodor Das mathematische Risiko der Versicherungsgesellschaften sowie aller auf dem Spiele des Zufalls beruhenden Institute Hannover Hahn 1885 VI 106 S. I. K. L. if 58 B J Prof. Dr.,3766THEODORWITTSTEINProf .Dr.),chunk_9,
20898,2111.0,JAHRE,2078,Jahre Jahre 150 Gebäudeversicherung im Kanton Zürich Illustr Zürich 1958 29 SG 611,2078JAHRE9 S.)G 611,chunk_4,
20899,2112.0,JAHRE,93440,Jahre Jahre 150 Gemeinnützigkeit Geschichte der Gemeinnützigen Gesellschaft des Kantons Zürich 1829 1979 Im Auftrag des Vorstandes erzählt von Dr. Anton von Schulthess Herausgegeben von der Gemeinnützigen Gesellschaft des Kantons Zürich Zürich 1979 24 cm 103 S,93440JAHREcm.103 S.i,chunk_4,
20900,2113.0,JAHRE,ORD.100,Jahre Jahre 150 Helbing Lichtenhahn Basel,"ORD.100JAHREn,   Baael",chunk_4,
20901,2114.0,JAHRE,97518,Jahre Jahre 150 Hurlimann Bier 1836 1986 Zürich 1986 30 cm 72 3 ill G Hrsger,97518JAHRE         -,chunk_4,
20902,2115.0,JAHRE,6643,Jahre Jahre 150 Neue Zürcher Zeitung 1780 1930 JTIÌJ i läxuns s ehr i f tft ¥3 Zürich AG f NZZ 1930 396 S,6643JAHRE.	(396 S.),chunk_4,
20903,2116.0,JAHRE,5035,150 Schuster Kleine Chronik einer Familie und des daraus hervorgegangenen Geschäftshauses von den Anfängen im Jahre 1795 bis zum Anfang des Jahres 1945 Illustr St. Gallen 1945 72 S 1945 5573,"5035JAHRE1945,5573.",chunk_4,
20904,2117.0,JAHRE,7623/B,Jahre Jahre 150 Schweizerische Mobiliar Versicherungsgesellschaft 1826 1976 Von Alfred Pezolt Willy Koenigungaf Wabern Berni Buchler Co. AG 1976 22 cm 100 S,"7623/BJAHRE2cm,100 S.",chunk_4,
20905,2118.0,JAHRE,2100,Jahre Jahre 175 Mecklenburgische Versicherungs-gesellschaft auf Gegenseitigkeit 1797 1972 Hannover 1972 28 cm 137 Sill,"2100JAHRE37 S.,ill.",chunk_4,
20906,2119.0,JAHRE,97444,Jahre Jahre 175 Sparkasse der Stadt Zurück 1805 1980 Zürich I 960 30 cm Falt-Ausgabe,97444JAHREt-Ausgabe.,chunk_4,
20907,2120.0,JAHRE,5135/23,Jahre Jahre 200 Bankhaus Rahn Bodmer 1750 1950 Mit l Portr Sfi SZürich Schulthese 1950 13 g,5135/23JAHRE0.	(13 g.),chunk_4,
20908,2101.0,EXPEDITION,82500,82500 Expedition Langensehe ist Taschenwörterbuch der englischen und deutschen Sprache,82500EXPEDITION Sprache. ,chunk_2,
20909,2102.0,EXPERIENCE,7420,Expérience Experience Erti sti with Unemployment Insurance a summary of evidence taken by the Royal Commission on unemployment insurance in 6 parts Part I Economic and historical background on unemployment insurance II Extent and character o,7420EXPERIENCEharacter o,chunk_2,
20910,2103.0,EXPERIENCE,3206,Experience 320 Combined of assured lives 1863 189 deduced from the records contributed by companies in respect of assurances effected within the United Kingdom unadjusted data whole life assurances males London Ch Clayton 1900,3206EXPERIENCEyton 1900.,chunk_2,
20911,2104.0,EXPERIENCE,3201,Experience 31 M Experience combined of assured lives 1863 1893 deduced from the records contributed by companies in respect of assurances effected within the United Kingdom unadjusted data whole life assurances females London Ch. Layton 1900,3201EXPERIENCEn 1900.	(1,chunk_2,
20912,2105.0,EXPERIENCE,3200,Experience jahre 1863–1893 deduziert aus den vom Unternehmen für innerhalb des Vereinigten Königreichs vorgenommenen Versicherungen beigetragenen Daten ungekürzter Endowmentversicherungen und geringfügiger Versicherungsarten,3200EXPERIENCEe Kale and,chunk_2,
20913,2106.0,EXPERIENCE,3202,Experience experience combined of life annuitants 1863 1893 deduced from the records contributed by companies in respect of annuities granted within the United Kingdom und leichtes Daten London Ch. Elyaton 1899 VIII 215 P,"3202EXPERIENCEI,215 P.) ",chunk_2,
20914,2107.0,EXPERIENCE,3000,Experience of thirty-four life companies upon ninety-eight special classes of risks compiled and published by the Actuarial Society of America New York 1903 fol. XIV 479 P. 207.,"3000EXPERIENCE    • i "" ",chunk_2,
20915,2108.0,EXPERIENTIA,,Experientia Experientia Supplementum IV a Verzar F Experimentelle Altersforschung,EXPERIENTIAforsohung ,chunk_2,
20916,2109.0,EXPERIODICA,,Experiodica Aperiódica Ur vom,"EXPERIODICA .. , vom ",chunk_2,
20917,2110.0,EXPERIODICA,,Eiperiodica Experiodica Zitate hrag von der Schweizer Rück a Rückversicherungs Gesellschaft Schweizerische Experiodica Zitate,EXPERIODICAitate ... ,chunk_2,
20918,2101.0,SCHEERER,,Scheerer Fritz a Hunziker Alois SF 1 Betriebe brauchen Betriebsstati stik,FRITZSCHEERERi- stik . ,chunk_7,
20919,2102.0,SCHEFFEL,84384,Scheffel Walter Scheffe Walter Computer Output Microfilm Anwendung Geräte Service Ukrodok Schriftenreihe Band 1 Langenfeld Scheffeiache Verlagsbuchhandlung 1975 · 20 x 21 cm 108 S Fig 14785,84384WALTERSCHEFFELig. 14785 ,chunk_7,
20920,2103.0,SCHEFFERS,,Scheffers Georgs Serret J. A. Lehrbuch der Differential und Integralrechnung 1907 1909 688,"GEORGSCHEFFERS1909, 688 ",chunk_7,
20921,2104.0,SCHEFFLER,,Scheffler Hermann. Scheffler-Herroann Beteiligung am Gewinne und Versorgung Braunschweig Vieweg Sohn 1862 S. 58 B. P. Oberbaurat,HERMANNSCHEFFLERbaurath ) ,chunk_7,
20922,2105.0,SCHEFFLER,3239,Scheffler Hermann Js Z 3 y Scheffier Hermann Sterblichkeit und Versicherungswesen Mit 2 Holzschnitten u 2 lithogr. Taf. Braunschweig: Vieweg Sohn 1868. X 352 S. 217 dr,3239HERMANNSCHEFFLER    d>r.) ,chunk_7,
20923,2106.0,SCHEIBLER,81258,Scheibler Kurt Scheibler Kurt Leitfaden für Experten Herausgeber Expertenkammer des STV Zürich Schweizerischer Technischer Verband STV 1978 21 cm 47 S 17384,81258KURTSCHEIBLER7 S 17384 ,chunk_7,
20924,2107.0,SCHEIDEGGER,,Scheidegger Bruno a Jahre 125 Kantonalbank von Bern,"BRUNOSCHEIDEGGERvon Bern, ",chunk_7,
20925,2108.0,SCHEIDEGGER,,Scheidegger Ernst s Zürich zurückgeblättert 1870 1914 Werden und Wandel einer Stadt Hrsg von Walter Baumann Alfred Cattaui Hugo Loetscher fund ES 1,ERNSTSCHEIDEGGERnd] E'S1. ,chunk_7,
20926,2109.0,SCHEIDEGGER,,Scheidegger Guido Scheidegger Guido Zum Problem der Rotation von Auswahl einheiten im 2. und k-Stichprobenfall Diss. Univ. Bern Zürich Am Messeri AG 1967 107 S G 884,GUIDOSCHEIDEGGERS.) G 884 ,chunk_7,
20927,2110.0,SCHEIDEGGER,,Scheidegger Jürg a Parago Peter SJ 1 Einflussfaktoren auf Bodenpreise in der Bauzone,JUERGSCHEIDEGGERone   ... ,chunk_7,
20928,2011.0,SUTER,84830,Suter Hans Rudolf Suter Hans Rudolf Allgemeine Bedingungen der Diebstahlversicherung Bern Verlag Peter Lang AG 1978 24 cm 226 S 20933,84830HANS RUDOLFSUTER6 S 20933 ,chunk_8,
20929,2012.0,SUTER,1862,Suter Hans Rudolf Suter Hans Rudolf Kollision sozialer und privater Unfallversicherung Dias Universität Bern Aarau HH Sauerländer 1936 VIII 125 S 8634,1862HANS RUDOLFSUTER S.) 8634 ,chunk_8,
20930,2013.0,SUTER,93191,Suter J. Suter J. Intelligenz und Begabungsprüfungen Zürich: Ráseter Co 1922 180 S. Dr. Priv. Doz.,93191J.SUTERriv.Doz.) ,chunk_8,
20931,2014.0,SUTER,,Suter Jürg. Suter Jürg. Die Fusion von Aktiengesellschaften im Privatrecht und im Steuerrecht. Zürcher Beiträge zur Rechtswissenschaft Neue Folge Heft 254 Zürich Schulthess 1966 XXIV 267 S 9014,JUERGSUTER S.) 9014 ,chunk_8,
20932,2015.0,SUTER,,Suter Ludwig s Restaurierung zur und Neueinrichtung der Stiftskirche St. Michael Beromünster Gestaltung LS1,LUDWIGSUTERng: L'S1} ,chunk_8,
20933,2016.0,SUTER,,Suter R s Tageszinstabellen,R.SUTERlen   ... ,chunk_8,
20934,2017.0,SUTER,6611,Suter Rudolf 6. Éff Suter Rudolf Basel Mosaik einer Stadt Photographien von Roger Bimpage Städte und Landschaften der Schweiz Herausg. Benjamin Laederer Bd. 2 Genf: Editions Générales 1957 208 S,6611RUDOLFSUTER	(208 S.) ,chunk_8,
20935,2018.0,SUTER,,Suter W B Nolfi PuWS Technische Grundlagen der Invalidenversicherung,W.SUTERerung ... ,chunk_8,
20936,2019.0,SUTER (CH/VAD),86975,86975 St. Suter CHVAD Gündling Christian Maximal Kundenorientierung Instrumente individuelle Problemlösungen Erfolgsgeschichten Stuttgart Schaffer Poeschel Verlag 1996 24 cm 477 S,86975ST.SUTER (CH/VAD)cm.477 S. ,chunk_8,
20937,2020.0,SUTER (CH/VAD),86976,86976 St Suter CHVAD Rappaport Alfred Shareholder Value Wertsteigerung als Maßstab für die Unternehmensführung Übersetzt aus dem Amerikanischen von Wolfgang Klein Titel der amerikanischen Originalausgabe Creating shareholder value The n,86976ST.SUTER (CH/VAD)lue. The n,chunk_8,
20938,2081.0,PAPIER,2069/21,Papier als Problem Eine Untersuchung über das Schriftgut in der Lebensversicherung Betriebstechnische Fragen der Lebensversicherung 21. Folge Herausgegeben vom Verband der Lebensversicherungsunternehmen e.V. Bonn Ausschuss für Betriebstechn,2069/21PAPIERriebstechn,chunk_6,
20939,2082.0,PAPIER,91717,Papier Hans Jürgen. Papier Hans Jürgen. Zulassungseinschränkungen für Ärzte aus verfassungsrechtlicher Sicht. PKV Dokumentation 11 Köln Verband der privaten Krankenversicherung e.V. 1985. 21 cm 70 S.,91717HANS-JÜRGENPAPIER G Hrsger ,chunk_6,
20940,2083.0,PAPIERFABRIK,,Papierfabrik Papierfabrik der Zürcher an der Sihl 1838 1938 e i Kinner FiBCÌ ili Hans Die Zürcher Papierfabrik 1938,PAPIERFABRIK   (1938Ï ,chunk_6,
20941,2084.0,PAPIERFABRIK BIBERIST,,apierfabrik Biberist s Jahre 100 Papierfabrik Biberist aa Papiermachen Einst und Jetzt,PAPIERFABRIK BIBERISTnd Jetzt. ,chunk_6,
20942,2085.0,PAPIERINDUSTRIE,,Papierindustrie in Papierindustrie die schweizerische in Vergangenheit und Gegenwart S. Lanz Werner Die schweizerische Papierindustrie,"PAPIERINDUSTRIEdustrie., ",chunk_6,
20943,2086.0,PAPIERMACHEN,98162,Papiermachen Papiermähen einst und jetzt Hrsg. von der Papierfabrik Biberist Auflage Zürich Conzett Huber AG Dr. 1977 25 cm 116 S 111,98162PAPIERMACHENS. ^	111. ,chunk_6,
20944,2087.0,PAPIERMACHEN,5271/2,Papiermachen Papiermachen Einst und Jetzt Illustration 3. Auflage I. Auflage Verfasst von Karl Fenchel Biberist 1965 111 S,5271/2PAPIERMACHEN	(111 S.) ,chunk_6,
20945,2088.0,PAQUET,7422G,Paquet Alfons. Paquet Alfons. und Berlin Abtruch und Aufbau der Reichshauptstadt Frankfurt am Main Societäts Verlag 1954 45 S 2409,7422GALFONSPAQUET S.) 2409 ,chunk_6,
20946,2089.0,PARASURAMAN,,Para Büraman A S Zeithaml VA Leonard L. Delivering quality service,A.PARASURAMANvice' ... ,chunk_6,
20947,2090.0,PARATTE,97385,Paratte G. P. Paratte G. Die Krankenversicherung. Provisorischer Leitfaden für Diplomkandidaten. Übersetzt aus dem Französischen von F. Landis. Basel 1969. 30 cm 89 Stab Taf vervielf,97385G.PARATTErvielf.]. ,chunk_6,
20948,2091.0,LIENHART,1961/8,Lienhart E. Lienhart E. E. Kauf und Verkauf im schweizerischen Recht Der Kaufvertrag und verwandte Verträge Die Umsatzgeschäfte Kauf Tausch Werklieferung Schenkung Rechtslehre für jedermann Heft 8 Zürich Gropengiesser 1943 32 S,1961/8E.LIENHART.	(32 S.) ,chunk_5,
20949,2092.0,LIENHART,1961/12,Lienhart E. Lienhart E. Sicherungen und Gestaltungsmöglichkeiten für den Gläubiger Bürgschaft Pfandverträge Eigentumsvorbehalt Retentionsrecht usw Das Gläubigerschutzbuch Rechtslehre für Jedermann Heft 12 Zürich Gropengiesser 1943 47 S 1944,"1961/12E.LIENHART S.) 1944,",chunk_5,
20950,2093.0,LIENHART,1961/3,Lienhart E. E. Das schweizerische Familienrecht Ehe Verwandtschaft Vormundschaft Was Jeder Mann von den familienrechtlichen Beziehungen wissen muss Rechtslehre für Jedermann Heft 3 Zürich Gropengiesser 1942 40 S,1961/3E.LIENHART.	(40 S.) ,chunk_5,
20951,2094.0,LIENHART,1961/2,Lienhart E. Lienhardt E. Das Schweizerische Personenrecht insbesondere das Vereinsrecht Wie gründe und leite ich einen Verein 15 Mit Mustern und Formularen Rechtslehre für jedermann Heft 2 Zürich Gropen Galeaser 1942 32 S 1,1961/2E.LIENHART	(32 S.) 1,chunk_5,
20952,2095.0,LIENHART,1961/1,Lienbart E. Lienhart E. Der schweizerische Rechtsspiegel Wae Jedermann von den Paragraphen wissen nebst dem unterhaltsamen und leichtfasslichen Rechtsbuch für jeden Mann Wit Wüstern und Tabellen Rechtslehre für jeden Mann He,1961/1E.LIENHARTrmann.  He,chunk_5,
20953,2096.0,LIENHART,6148,Lienhart Lienhart E E Das schweizerische Versicherungsrecht Die Bundesgesetze Bundesbeschlüsse Verordnungen und Bundesratsbeschlüsse Über das private und öffentliche Versicherungswesen nachgeführt bis zum 1. April 1938,"6148E.LIENHARTil  1938, ",chunk_5,
20954,2097.0,LIER,331/8,Lier Hans Lier Hans Wehrli Bernhard Brevier für Klein und Mittelunternehmungen Praktische Hinweise für Unternehmungsleiter Schriftenreihe des Vororts 8 Zürich Vorort des Schweizerischen Handels- und Industrie-Vereins 1977 24 cm,331/8HANSLIER  -24cm. 3,chunk_5,
20955,2098.0,LIESCHING,,Lieaching Idesching Über Lebensversicherung 00187 52 S 58B ™,LIESCHINGS.) 58B	™ ,chunk_5,
20956,2099.0,LIESSMANN,,Liessmann Konrads Mayer Elmar LK 1 Martens Hans Werner Kostenrechnung Grundwissen für den ControllerDienst,KONRADLIESSMANNienst ... ,chunk_5,
20957,2100.0,LIFE,97587,Life Life assurance and inflation Report prepared by the Life Working Group Paris Comité Européen des Assurances 1976 30 cm 45 leaves,97587LIFE5  leafs. ,chunk_5,
20958,2011.0,GIERISCH,97629,Gierisch Markus Gierisch Markus Huber Hermann Wittwer Hans Jakob Wohnung- und Haushaltsgröße Anleitung zur Nutzungsanalyse von Grundrissen Schriftenreihe Wohnungswesen Band 53 Bern Bundesamt für Wohnungswesen 1993 • 30 cm A 65 S,"97629MARKUSGIERISCH. A	65 S.,",chunk_3,
20959,2012.0,GIERKE,,Gierte Julius von Gierjfce Julius von Die Versicherungsvereine auf Gegenseitigkeit nach deutschem Recht Abhandlungen aus dem gesamten Handelsrecht Bürgerlichen Recht und Konkursrecht Heft 20 Stuttgart: FEnke 1942 116 S. f. 1942 3497 Prof,JULIUS VONGIERKE497.	(Prof,chunk_3,
20960,2013.0,GIERKE,,Gierke Otto Gierke. Das deutsche Genossenschaftsrecht Bd I Rechtsgeschichte der deutschen Genossenschaft Bd II. Geschichte des deutschen Körperschaftsbegriffs Bd III. Die Staats- und Korporationslehre des Altertums und des Mittelalters und ihre Auswertung,OTTOGIERKEnd ihre Au,chunk_3,
20961,2014.0,GIERSING,,Giersing Else S. Jensen Orla Social welfare in Denmark,ELSEGIERSINGn Denmark ,chunk_3,
20962,2015.0,GIESE,,Glose Bernhard s Atlas ärztlicher Behandlungsfehler für die Bundesrepublik Deutschland Jahrbuch für Medizinische Forschung Hrsg. von BIG,BERNHARDGIESE B1G* ... ,chunk_3,
20963,2016.0,GIESE,1559,Ciese » Friedrich Olese Friedrich und Engelhard Niemann Das Devisengesetz Reichsgesetz vom 12.12.1938 mit allen ergänzenden Vorschriften Ein systematischer Kommentar Mit Nachträgen Köln Schmidt 1939 A J fl 1940 2761¿¡r ™ Prof. D,1559FRIEDRICHGIESE™ (Prof .D,chunk_3,
20964,2017.0,GIESEN,,Giesen Dieter Giesen Dieter Arzthaftungsrecht Die zivilrechtliche Haftung aus medizinischer Behandlung in der Bundesrepublik Deutschland in Österreich und der Schweiz 3. Auflage Früher unter den Wandlungen des Arzthaftungsrechts.,DIETERGIESENchts11]. J,chunk_3,
20965,2018.0,GIESEN,85022,Giesen Dieter Giesen Dieter Arzthaftungsrecht Die zivilrechtliche Verantwortlichkeit des Arztes in rechtsvergleichender Sicht Medical malpractice law A comparative law study of civil responsibility arising from medical care Industriegesellschaft,85022DIETERGIESENtriegesell,chunk_3,
20966,2019.0,GIESSEN,87922,Giessen Saskia Nakanishi Hiroshi Outlook 97 Die blaue Reihe Kaarst bhv Verlags GmbH 1997 37748™,87922SASKIAGIESSEN) 37748	™ ,chunk_3,
20967,2020.0,GIESSEN,86092,"Giessen, Saskia Giessen, Saskia. Nakanishi, Hiroshi. DataEase Schulung Pur Selbststudium und Gruppenunterricht Programmierte Unterweisung in dem Datenbanksystem DataBase Version 25 Release 3 Mit Diskette Haar b. München Markt Tech",86092SASKIAGIESSENrkt & Tech,chunk_3,
20968,2111.0,WITTSTEIN,3253,"Wittstein, Theodor. Wittstein, Theodor. Das mathematische Gesetz der menschlichen Sterblichkeit. Hannover: Hahn 1883. (65 S.) 56 B V Prof. Dr.",3253THEODORWITTSTEIN(Prof.Dr.),chunk_9,
20969,2112.0,WITTWEILER,700075,Wittweiler Bernhard Wittweiler Bernhard Der Geltungsbereich der schweizerischen Verwertungsgesetzgebung Diss Univ Zürich Bern Stampili Cië AG 1988 23 cm 162 SG Dr Kühn,700075BERHARDWITTWEILERSG Dr.Kühn,chunk_9,
20970,2113.0,WITTWER,,Vittwer Hans — Jakobs Gierisch Markus Huber Hermann Wohnung und Haushaltgröße Anleitung zur Nutzungsanalyse von Grundrissen,HANS-JAKOBWITTWERundrissen.,chunk_9,
20971,2114.0,WITWEN-,,Witwen Witwen und Waisenkasse akademische in Berns Moser und Graf Akademische Witwen und Waisenkasse 1907,WITWEN-    (1907),chunk_9,
20972,2115.0,WITWEN-,94033,e n Witwen und Vaterschaftsstiftung Bürgerliche der Stadt Zürich Hundert Jahre 1816–1916 Zürich Buchdruckers Berichthaus 1916 25 cm A 38 Staf,"94033WITWEN-38 S.,Taf.",chunk_9,
20973,2116.0,WITWER-,,Witwer Witwer Witwen- und Waisenverein zum Kreuz Zürich 1870 30 S 58 B,WITWER-(30 S.)58B,chunk_9,
